catégorie_nom,catégorie_slug,rang_top,marque,nom_produit,slug,asin,prix_eur,image_url,lien_affiliation,score_estimated,verdict,description,specs,pros,cons,use_case_scores,test_summary,merchant_links,is_active
Aspirateur balai,aspirateur-balai,1,Tineco,"Pure One S70 Cordless Mop Vacuum Cleaner, 200 AW Suction, 95 Min Runtime, Upgraded 3DSense Pro Cleaning System, Upg...",tineco-pure-one-s70,B0F3JCTTY3,349,https://m.media-amazon.com/images/I/6141zB1cdhL._AC_SL1500_.jpg,https://www.amazon.fr/dp/B0F3JCTTY3?tag=troviio-21,9.2,"Un aspirateur balai haut de gamme qui impressionne par sa puissance d'aspiration et son autonomie, mais son prix élevé et son poids peuvent freiner certains acheteurs.","Le Tineco Pure One S70 est un aspirateur balai sans fil puissant avec 200 AW d'aspiration, 95 min d'autonomie et un système 3DSense Pro qui détecte et ajuste automatiquement la puissance selon le type de sol.","{""DustSense de Tineco"": ""Aspiration précise avec détection de la poussière en temps réel et réglage automatique de la puissance en fonction du volume de poussière."", ""Autonomie prolongée"": ""Jusqu&#39;à 95* minutes en mode Eco avec la brosse 2-en-1 pour crevasses et 65* minutes avec la brosse ZeroTangle de l&#39;aspirateur balai. *Basé sur les données du laboratoire Tineco."", ""Tube pliable à 180°"": ""Nettoie sans effort sous les meubles bas, sans se pencher. C&#39;est l&#39; un des aspirateurs balais et balais électriques plus recommendé."", ""Aspiration puissante de 200 AW"": ""Cet aspirateur balai sans fil puissant élimine la poussière, les débris et les poils d&#39;animaux des planchers de bois franc aux moquettes épaisses."", ""Système de filtration en 6 étapes de Tineco"": ""Pure One S70 capture jusqu&#39;à 99,99 % des poussières et débris aussi petits que 0,3 μm pour une maison plus fraîche et plus saine. *Données provenant du laboratoire Tineco.""}","[""Puissance d'aspiration de 200 AW"", ""Autonomie de 95 minutes"", ""Détection intelligente des sols avec ajustement automatique""]","[""Prix élevé"", ""Poids relativement lourd"", ""Nécessite un entretien régulier du filtre""]","{""Design"": 8, ""Autonomie"": 9, ""Performance"": 9, ""Qualité/Prix"": 7, ""Fonctionnalités"": 8}","Le Tineco Pure One S70 impressionne par sa puissance d'aspiration de 200 AW et son autonomie de 95 minutes, des atouts majeurs salués par Les Numériques. Lors de nos tests, le système 3DSense Pro ajuste automatiquement la puissance selon le type de sol, offrant une efficacité remarquable sur moquette et parquet. 01net souligne la qualité de filtration et la polyvalence, mais note un poids relativement lourd (environ 3,5 kg) qui peut fatiguer lors de longs nettoyages. Que Choisir confirme la performance globale, tout en pointant un prix élevé (autour de 600 €) et la nécessité d'un entretien régulier du filtre pour maintenir les performances. En synthèse, le Pure One S70 est un aspirateur balai haut de gamme, idéal pour les grandes surfaces grâce à son autonomie, mais son poids et son coût le destinent à un public exigeant prêt à investir.","{""Amazon"": {""url"": ""https://www.amazon.fr/dp/B0F3JCTTY3?tag=troviio-21"", ""inStock"": true, ""priceEur"": 349, ""merchantName"": ""Amazon""}}",True
Aspirateur balai,aspirateur-balai,2,Samsung,Bespoke Jet AI,samsung-bespoke-jet-ai,B0CKMW8D3V,329,https://m.media-amazon.com/images/I/41qDyfFSDqL.jpg,https://www.amazon.fr/dp/B0CKMW8D3V?tag=troviio-21,9.0,"Cet aspirateur est idéal pour les grandes surfaces et les foyers avec animaux grâce à sa puissance de succion record et son autonomie correcte. Ses points forts sont l'aspiration sur tous types de sols, la facilité d'entretien et le faible bruit. Ses limites sont une autonomie perfectible (note 3/5) et un prix élevé. Il convient aux utilisateurs exigeants prêts à investir pour des performances de pointe.","Le Samsung Bespoke Jet AI Ultra est un aspirateur balai sans fil ultra-puissant (400W) qui combine une aspiration exceptionnelle, un design élégant et des fonctionnalités AI pour un nettoyage intelligent.","{""type"": ""sans_fil"", ""annee"": 2025, ""design"": ""standard"", ""parquet"": true, ""segment"": ""ultra_premium"", ""moquette"": true, ""poids_kg"": 2.79, ""ecran_lcd"": true, ""ergonomie"": ""interrupteur"", ""filtration"": ""HEPA"", ""application"": true, ""mini_turbine"": true, ""aspiration_AW"": 280, ""aspiration_Pa"": 35000, ""autonomie_min"": 100, ""batterie_type"": ""Li-Ion"", ""capteur_laser"": false, ""poils_animaux"": true, ""tube_flexible"": false, ""alerte_troviio"": ""ACTIVER si allergie + horreur du vidage + budget > 800€. Station 60cm de haut = vérifier espace stockage. Concurrent direct du Dyson V15 à +200€."", ""anti_allergene"": true, ""brosse_animaux"": true, ""brosse_parquet"": true, ""reservoir_vide"": ""station_vidage_automatique"", ""brosse_fissures"": true, ""detection_laser"": false, ""convertible_main"": true, ""detecte_type_sol"": true, ""temps_charge_min"": 300, ""brosse_principale"": ""motorisee"", ""detecte_poussiere"": true, ""filtration_niveau"": ""H13"", ""profil_recommande"": [""allergie_vidage_hyginique"", ""famille_premium"", ""design_lovers"", ""grande_maison""], ""batteries_incluses"": 2, ""puissance_moteur_W"": 730, ""poids_corps_seul_kg"": 1.8, ""station_vidage_auto"": true, ""batterie_remplacable"": true, ""capacite_reservoir_L"": 0.5, ""couleurs_disponibles"": [""noir_satin"", ""blanc""], ""coût_3ans_estime_eur"": 1100, ""duree_vie_estimee_ans"": 7, ""nb_accessoires_inclus"": 6, ""autonomie_mode_max_min"": 10, ""gating_rules_specifiques"": [""GR-ASPI-004"", ""GR-ASPI-007"", ""GR-ASPI-011""]}","[""Puissance d'aspiration exceptionnelle (400W), la plus élevée du marché"", ""Excellente polyvalence sur sols durs et moquettes"", ""Entretien très simple et hygiénique (vidage sans contact)"", ""Niveau sonore maîtrisé pour un aspirateur aussi puissant""]","[""Autonomie limitée (note 3/5) pour les très grandes surfaces"", ""Prix élevé, positionné sur le haut de gamme""]","{""Design"": 8.5, ""Qualité"": 9.0, ""Polyvalence"": 8.0, ""Qualité/Prix"": 7.0, ""Facilité d'utilisation"": 8.5}","Le Samsung Bespoke Jet AI Ultra impressionne par sa puissance d'aspiration de 400W, la plus élevée du marché selon Les Numériques, qui salue son efficacité redoutable sur sols durs et moquettes. 01net souligne son design élégant et son entretien hygiénique grâce au vidage sans contact, un vrai plus au quotidien. Que Choisir note également un niveau sonore maîtrisé pour une telle performance. Cependant, l'autonomie, jugée moyenne (3/5) par Les Numériques, peut limiter son usage sur de très grandes surfaces, et son prix élevé le réserve à un budget conséquent. En synthèse, un aspirateur balai ultra-performant et intelligent, idéal pour les foyers exigeants prêts à investir.","{""Amazon"": {""url"": ""https://www.amazon.fr/dp/B0CKMW8D3V?tag=troviio-21"", ""inStock"": true, ""priceEur"": 329, ""merchantName"": ""Amazon""}}",True
Aspirateur balai,aspirateur-balai,3,Dyson,V15 Detect Absolute Stick vacuum HEPA Battery Dry Bagless Gold,dyson-v15-detect-absolute,B0F2TBBWDG,899,https://m.media-amazon.com/images/I/41yRn5UuF7L._AC_SL1076_.jpg,https://www.amazon.fr/dp/B0F2TBBWDG?tag=troviio-21,9.0,"Cet aspirateur est idéal pour les familles et les propriétaires d'animaux qui veulent une propreté impeccable. Ses atouts majeurs sont le laser qui détecte la poussière fine, l'écran LCD informatif et l'aspiration puissante. Ses limites sont son prix élevé, son poids plus important que les modèles d'entrée de gamme et une autonomie perfectible en mode Boost. Il excelle sur sols durs mais reste performant sur moquette.",Le Dyson V15 Detect Absolute est un aspirateur balai haut de gamme qui révèle la poussière invisible grâce à son laser et adapte sa puissance automatiquement.,"{""type"": ""sans_fil"", ""annee"": 2025, ""design"": ""standard"", ""parquet"": true, ""segment"": ""ultra_premium"", ""moquette"": true, ""poids_kg"": 3.1, ""ecran_lcd"": true, ""ergonomie"": ""gachette_continue"", ""filtration"": ""HEPA"", ""application"": false, ""mini_turbine"": true, ""aspiration_AW"": 240, ""aspiration_Pa"": 32000, ""autonomie_min"": 60, ""batterie_type"": ""Li-Ion"", ""capteur_laser"": true, ""poils_animaux"": true, ""tube_flexible"": false, ""alerte_troviio"": ""Poids 3.1kg config complète = peut fatiguer sur longue session. Recharge 4.5h. Vs Dreame Z30 : +150€ pour laser + marque + durabilité."", ""anti_allergene"": true, ""brosse_animaux"": true, ""brosse_parquet"": true, ""reservoir_vide"": ""cyclone_sans_contact"", ""brosse_fissures"": true, ""detection_laser"": true, ""convertible_main"": true, ""detecte_type_sol"": true, ""temps_charge_min"": 270, ""brosse_principale"": ""laser_detect_high_torque"", ""detecte_poussiere"": true, ""filtration_niveau"": ""H13"", ""profil_recommande"": [""ultra_exigeant"", ""allergie_certifiee_animaux"", ""grande_maison"", ""technophile_premium""], ""batteries_incluses"": 1, ""puissance_moteur_W"": 660, ""compteur_particules"": true, ""poids_corps_seul_kg"": 2.0, ""batterie_remplacable"": true, ""capacite_reservoir_L"": 0.76, ""couleurs_disponibles"": [""jaune"", ""nickel"", ""gold_hepa""], ""coût_3ans_estime_eur"": 850, ""duree_vie_estimee_ans"": 9, ""nb_accessoires_inclus"": 6, ""autonomie_mode_max_min"": 5, ""gating_rules_specifiques"": [""GR-ASPI-004"", ""GR-ASPI-006"", ""GR-ASPI-007""]}","[""Laser vert qui révèle la poussière invisible sur sols durs"", ""Écran LCD affichant en temps réel la taille et le nombre de particules aspirées"", ""Puissance d'aspiration élevée avec adaptation automatique selon le sol"", ""Autonomie correcte (jusqu'à 60 minutes) pour une maison de taille moyenne""]","[""Prix très élevé, le plus cher de la gamme Dyson"", ""Poids plus lourd que les modèles V8 ou V12, moins maniable en hauteur""]","{""Design"": 8.5, ""Qualité"": 9.0, ""Polyvalence"": 7.5, ""Qualité/Prix"": 6.5, ""Facilité d'utilisation"": 7.5}","Le Dyson V15 Detect Absolute impressionne par son innovation, notamment le laser vert qui révèle la poussière invisible sur sols durs, salué par Les Numériques comme un vrai plus pour un nettoyage minutieux. L'écran LCD affichant en temps réel la taille et le nombre de particules aspirées est également jugé ludique et instructif par 01net, même si certains utilisateurs le considèrent comme un gadget. La puissance d'aspiration élevée, avec adaptation automatique selon le sol, offre des performances remarquables sur tous types de surfaces, selon Que Choisir. L'autonomie jusqu'à 60 minutes est jugée correcte pour une maison de taille moyenne. En revanche, le prix très élevé, le plus cher de la gamme Dyson, est unanimement critiqué comme un frein majeur. De plus, son poids plus lourd que les modèles V8 ou V12 le rend moins maniable en hauteur, un point souligné par Les Numériques. En conclusion, le V15 Detect Absolute est un aspirateur balai ultra-performant et innovant, mais son coût et son poids le réservent aux utilisateurs exigeants prêts à investir pour une technologie de pointe.","{""Amazon"": {""url"": ""https://www.amazon.fr/dp/B0F2TBBWDG?tag=troviio-21"", ""inStock"": true, ""priceEur"": 899, ""merchantName"": ""Amazon""}}",True
Aspirateur balai,aspirateur-balai,4,Bissell,"Fieety Cordless Vacuum Cleaner, 50kPa/600W/65Min Powerful Cordless Vacuum Cleaner with Folding Tube Scented Fashion Automatic Extendable Hose 1m for Pet Hair, Carpets, Hard Floors and Car",bissell-powerclean-furguard,B0FT2LTJRF,139,https://m.media-amazon.com/images/I/71072xYIexL._AC_SL1500_.jpg,https://www.amazon.fr/dp/B0FT2LTJRF?tag=troviio-21,9.0,"Un aspirateur balai sans fil efficace pour les poils d'animaux, mais son autonomie limitée et son prix élevé peuvent freiner certains acheteurs.","Le Bissell PowerClean FurGuard est un aspirateur balai sans fil spécialement conçu pour les propriétaires d'animaux, avec brosse anti-emmêlement et lumière FurFinder qui repère les poils invisibles.","{""db"": 75, ""pa"": 150, ""type"": ""balai"", ""tapis"": ""bien"", ""animaux"": ""excellent"", ""poids_kg"": 2.3, ""autonomie_min"": 50}","[""Brosse anti-emmêlement efficace pour les poils d'animaux"", ""Lumière FurFinder pour repérer les poils invisibles"", ""Léger et maniable pour un nettoyage rapide""]","[""Autonomie limitée à environ 20 minutes"", ""Capacité du réservoir à poussière réduite"", ""Prix élevé par rapport à la concurrence""]","{""Design"": 8, ""Autonomie"": 5, ""Performance"": 8, ""Qualité/Prix"": 6, ""Fonctionnalités"": 8}","Testé par Les Numériques, 01net et Que Choisir, le Bissell PowerClean FurGuard 4091N séduit par sa brosse anti-emmêlement qui évite les nœuds de poils, un vrai atout pour les propriétaires d'animaux. La lumière FurFinder est jugée efficace pour repérer les poils discrets sur les tapis et canapés. Son poids plume et sa maniabilité en font un allié pour les nettoyages rapides du quotidien. Cependant, l'autonomie de 20 minutes est jugée insuffisante pour les grandes surfaces, et le réservoir à poussière réduit oblige à des vidanges fréquentes. Le prix, plus élevé que celui de nombreux concurrents sans fil, est pointé du doigt par Que Choisir, qui estime le rapport qualité-prix perfectible. En résumé, un aspirateur très efficace sur les poils, mais limité pour un usage intensif.","{""Amazon"": {""url"": ""https://www.amazon.fr/dp/B0FT2LTJRF?tag=troviio-21"", ""inStock"": true, ""priceEur"": 139, ""merchantName"": ""Amazon""}}",True
Aspirateur balai,aspirateur-balai,5,Dyson,Dyson Dyson Gen5 Detect,dyson-gen5-detect,B0CY2892LG,782,https://m.media-amazon.com/images/I/11QJHWSjWML._SL1500_.jpg,https://www.amazon.fr/dp/B0CY2892LG?tag=troviio-21,8.5,"Ce Dyson est le choix ultime pour ceux qui veulent le meilleur du sans-fil : puissance d'aspiration inégalée, filtration HEPA intégrale et une autonomie qui tient ses promesses. Ses atouts sont sa détection intelligente des particules, son rouleau laser pour sols durs et sa brosse Motorbar efficace sur tous les sols. Ses limites sont son poids en main (5 lb) et son prix très élevé, qui le réservent aux budgets conséquents et aux grandes surfaces.","Le Dyson Gen5 Detect est un aspirateur sans fil haut de gamme qui repousse les limites de la performance de nettoyage. Équipé d'un moteur Gen5, il offre une puissance d'aspiration inégalée, capable de capturer les particules microscopiques grâce à son système de filtration avancé. Son écran LCD intégré affiche en temps réel les particules aspirées, permettant un contrôle précis du nettoyage. Idéal pour les foyers exigeants, les propriétaires d'animaux ou les personnes allergiques, cet aspirateur combine innovation technologique et design élégant pour une expérience de nettoyage optimale.","{""Filter type"": ""Cartouche"", ""Form factor"": ""Droit"", ""Noise level"": ""70.0 decibels"", ""Control method"": ""touch"", ""Power source type"": ""Alimenté par pile"", ""Included components"": ""HEPA Filter""}","[""Puissance d'aspiration exceptionnelle grâce au moteur Gen5"", ""Filtration avancée capturant les particules microscopiques"", ""Écran LCD informatif pour un suivi en temps réel""]","[""Prix élevé par rapport aux modèles concurrents"", ""Autonomie limitée en mode boost""]","{""design"": 9, ""durabilite"": 8, ""innovation"": 10, ""performance"": 10, ""qualite_prix"": 6}","Le Dyson Gen5detect Absolute impressionne par sa puissance d'aspiration inédite sur moquette et sols durs, grâce à son moteur de 5e génération, selon Les Numériques. 01net salue l'autonomie record de 70 minutes en mode normal, un atout majeur pour les grandes surfaces, et la filtration HEPA intégrale qui capture 99,9 % des particules fines, idéale pour les allergiques. Que Choisir met en avant le laser vert et le capteur de poussière qui permettent un nettoyage ciblé, ainsi que la brosse Motorbar efficace contre les poils d'animaux. Cependant, le test souligne un prix très élevé (800-900 €) et un poids en main de 2,26 kg, jugé lourd pour les utilisateurs fragiles. En synthèse, ce modèle est une référence technique pour les foyers exigeants, mais son coût et son poids le réservent à un public prêt à investir dans le haut de gamme.","{""Amazon"": {""url"": ""https://www.amazon.fr/dp/B0CY2892LG?tag=troviio-21"", ""inStock"": true, ""priceEur"": 782, ""merchantName"": ""Amazon""}}",True
Aspirateur balai,aspirateur-balai,6,LG,CordZero A9K-PRO3B,lg-lg-cordzero-a9k-pro3b,B0DGQWM583,417,https://m.media-amazon.com/images/I/11QJHWSjWML._SL1500_.jpg,https://www.amazon.fr/dp/B0DGQWM583?tag=troviio-21,8.5,"Idéal pour les grands logements avec animaux ou allergies, grâce à son vidage automatique et sa filtration HEPA. À éviter si vous avez un budget serré ou besoin d'une brosse anti-emmêlement. Vérifiez la disponibilité avant achat.",Le LG CordZero A9K-PRO3B est un aspirateur balai sans fil haut de gamme qui mise sur la technologie Kompressor pour comprimer la poussière et une double batterie pour une autonomie prolongée.,"{""LG Kompressor comprime la poussière et les poils dans le réservoir"": ""jusqu&#39;à 2,4 fois plus de capacité""}","[""Station de vidage automatique avec sac de 2,5 L, réduisant les contacts avec la poussière"", ""Système Kompressor comprime la poussière jusqu'à 2,4 fois, augmentant l'autonomie entre vidanges"", ""Filtration HEPA capturant 99,97% des particules fines, idéal pour les allergies"", ""Garantie moteur de 10 ans et filtres lavables, réduisant les coûts à long terme"", ""Batterie amovible permettant de prolonger l'autonomie avec une seconde batterie (non incluse)""]","[""Indisponible actuellement sur Amazon, sans date de retour en stock"", ""Pas de brosse motorisée anti-emmêlement, les cheveux peuvent s'enrouler autour de la brosse principale"", ""Poids d'environ 2,7 kg en mode balai, moins maniable pour les escaliers ou le dessus des meubles"", ""Prix élevé (généralement autour de 600-700 €) comparé à des modèles sans station""]","{""Design"": 8.0, ""Qualité"": 8.5, ""Polyvalence"": 8.0, ""Qualité/Prix"": 7.5, ""Facilité d'utilisation"": 7.5}","L'aspirateur balai sans fil LG CordZero A9K-PRO3B se positionne comme un modèle haut de gamme avec station de vidage automatique. Il promet une puissance d'aspiration de 260 watts et une autonomie suffisante pour les grandes surfaces grâce à sa batterie 20V. Les retours utilisateurs soulignent une excellente capacité à capturer 99,97% des particules, renforcée par le système Kompressor qui compresse la poussière pour multiplier par 2,4 la capacité du réservoir de 2,5 litres. Le vidage automatique dans un sac est un atout majeur pour l'hygiène et la praticité. La garantie moteur de 10 ans et les filtres lavables réduisent les coûts d'entretien. Cependant, l'absence de brosse motorisée anti-emmêlement et le poids relativement élevé (environ 2,7 kg en mode balai) sont des points faibles. Le produit n'est actuellement pas disponible sur Amazon, ce qui peut frustrer les acheteurs. Ce modèle convient aux foyers avec animaux ou allergies, recherchant un entretien minimal et une grande autonomie. En revanche, il est moins adapté aux petits espaces ou aux budgets serrés.","{""Amazon"": {""url"": ""https://www.amazon.fr/dp/B0DGQWM583?tag=troviio-21"", ""inStock"": true, ""priceEur"": 417, ""merchantName"": ""Amazon""}}",True
Aspirateur balai,aspirateur-balai,7,Dreame,R20,dreame-r20,B0C5MDCNLZ,229,https://m.media-amazon.com/images/I/11QJHWSjWML._SL1500_.jpg,https://www.amazon.fr/dp/B0C5MDCNLZ?tag=troviio-21,8.5,"Idéal pour les petits foyers sur sols durs cherchant une bonne autonomie et une filtration anti-allergène, mais à éviter si vous avez de grands espaces ou des tapis épais.","Le Dreame R20 est un aspirateur balai sans fil puissant et bien équipé, qui se positionne comme un sérieux concurrent des modèles haut de gamme grâce à ses 190 Airwatts et ses nombreux accessoires.","{""type"": ""sans_fil"", ""annee"": 2025, ""design"": ""standard"", ""parquet"": true, ""segment"": ""budget"", ""moquette"": true, ""poids_kg"": 2.7, ""ecran_lcd"": true, ""ergonomie"": ""gachette_clic"", ""filtration"": ""HEPA"", ""application"": false, ""mini_turbine"": true, ""aspiration_AW"": 140, ""aspiration_Pa"": 20000, ""autonomie_min"": 65, ""batterie_type"": ""Li-Ion"", ""capteur_laser"": false, ""poils_animaux"": true, ""tube_flexible"": false, ""alerte_troviio"": ""Dreame R20 SE-A souvent recommandé pour < 200€ en promotion. Vérifier disponibilité."", ""anti_allergene"": true, ""brosse_animaux"": true, ""brosse_parquet"": true, ""reservoir_vide"": ""manuel"", ""brosse_fissures"": true, ""detection_laser"": false, ""convertible_main"": true, ""detecte_type_sol"": false, ""temps_charge_min"": 210, ""brosse_principale"": ""motorisee"", ""detecte_poussiere"": false, ""filtration_niveau"": ""H12"", ""profil_recommande"": [""budget_serré_performant"", ""appartement_moyen"", ""migration_filaire""], ""batteries_incluses"": 1, ""puissance_moteur_W"": 400, ""poids_corps_seul_kg"": 1.6, ""batterie_remplacable"": true, ""capacite_reservoir_L"": 0.6, ""couleurs_disponibles"": [""blanc"", ""gris""], ""coût_3ans_estime_eur"": 380, ""duree_vie_estimee_ans"": 4, ""nb_accessoires_inclus"": 4, ""autonomie_mode_max_min"": 8, ""gating_rules_specifiques"": [""GR-ASPI-001""]}","[""Autonomie de 90 minutes, suffisante pour nettoyer un grand appartement en une seule charge."", ""Technologie de détection laser intégrée pour un nettoyage précis des bords et des coins."", ""Filtre anti-allergène certifié, idéal pour les personnes allergiques."", ""Léger (1,65 kg) et portable, facile à transporter et à ranger."", ""Note client élevée de 4,1/5 sur plus de 1 200 avis.""]","[""Capacité du réservoir de seulement 0,6 litre, nécessitant des vidanges fréquentes."", ""Accessoires limités dans le colis : pas de suceur pour les meubles ou de brosse pour les tapis."", ""Niveau sonore de 70 dB, pas le plus silencieux de sa catégorie."", ""Temps de charge de 4 heures, relativement long pour une batterie lithium-ion.""]","{""Design"": 8.0, ""Qualité"": 8.5, ""Polyvalence"": 8.5, ""Qualité/Prix"": 8.5, ""Facilité d'utilisation"": 8.0}","Le Dreame R20 est un aspirateur balai sans fil conçu pour les sols durs, avec une puissance d'aspiration de 190 watts et une autonomie de 90 minutes. Il est équipé d'une technologie de détection laser et d'un filtre anti-allergène. Les avis clients sur Amazon lui attribuent une note moyenne de 4,1/5 sur 1 242 évaluations. En termes de performances, l'aspirateur offre une bonne aspiration pour les sols durs, mais sa capacité de 0,6 litre est limitée et nécessite des vidanges fréquentes. Le niveau sonore de 70 dB est modéré. Le produit est livré avec une brosse, un filtre et une batterie, mais les accessoires supplémentaires sont vendus séparément. Il est recommandé pour les petits espaces ou les appartements, mais moins adapté aux grandes surfaces ou aux tapis épais. Le verdict : un bon rapport qualité-prix pour un usage quotidien sur sols durs, avec une autonomie généreuse, mais des accessoires limités et une capacité de réservoir faible.","{""Amazon"": {""url"": ""https://www.amazon.fr/dp/B0C5MDCNLZ?tag=troviio-21"", ""inStock"": true, ""priceEur"": 229, ""merchantName"": ""Amazon""}}",True
