catégorie_nom,catégorie_slug,rang_top,marque,nom_produit,slug,asin,prix_eur,image_url,lien_affiliation,score_estimated,verdict,description,specs,pros,cons,use_case_scores,test_summary,merchant_links,is_active
Aspirateur balai,aspirateur-balai,14,Bissell,CrossWave Cordless Max,bissell-crosswave-cordless,B098KLVY75,400,https://m.media-amazon.com/images/I/B098KLVY75._SL1500_.jpg,https://www.amazon.fr/dp/B098KLVY75?tag=troviio-21,8.0,"Idéal pour les petits appartements avec sols durs et peu de tapis, mais à éviter si vous avez de grandes surfaces ou des animaux domestiques.","Le Bissell CrossWave Cordless Max est un nettoyeur 3-en-1 qui aspire, lave et sèche les sols en un seul passage, idéal pour un entretien rapide et efficace.","{""type"": ""laveur_aspirateur"", ""annee"": 2024, ""design"": ""large"", ""parquet"": true, ""segment"": ""premium"", ""moquette"": true, ""poids_kg"": 5.2, ""ecran_lcd"": true, ""ergonomie"": ""interrupteur"", ""filtration"": ""standard"", ""application"": true, ""mini_turbine"": false, ""aspiration_AW"": 50, ""aspiration_Pa"": 10000, ""autonomie_min"": 30, ""batterie_type"": ""Li-Ion"", ""capteur_laser"": false, ""poils_animaux"": true, ""tube_flexible"": false, ""alerte_troviio"": ""Préférer Tineco S5 pour compacité et capteur iLoop. CrossWave = robustesse brute américaine, usage intensif."", ""anti_allergene"": false, ""brosse_animaux"": false, ""brosse_parquet"": true, ""reservoir_vide"": ""manuel"", ""brosse_fissures"": false, ""detection_laser"": false, ""convertible_main"": false, ""detecte_type_sol"": false, ""temps_charge_min"": 240, ""brosse_principale"": ""rouleau_multisurface"", ""detecte_poussiere"": false, ""filtration_niveau"": ""E10"", ""profil_recommande"": [""grande_maison_carrelage"", ""famille_nombreuse"", ""lavage_intensif""], ""batteries_incluses"": 1, ""puissance_moteur_W"": 250, ""poids_corps_seul_kg"": 5.2, ""batterie_remplacable"": false, ""capacite_reservoir_L"": 0.82, ""couleurs_disponibles"": [""noir"", ""gris""], ""coût_3ans_estime_eur"": 620, ""duree_vie_estimee_ans"": 5, ""nb_accessoires_inclus"": 2, ""autonomie_mode_max_min"": 30, ""gating_rules_specifiques"": []}","[""Nettoyage simultané aspiration et lavage sur sols durs, gain de temps."", ""Autonomie de 20 minutes en usage réel, suffisante pour un appartement de 50 m²."", ""Poids léger de 4,5 kg, facile à manœuvrer."", ""Mode auto-nettoyant des brosses, pratique après chaque utilisation.""]","[""Autonomie réelle de 20 minutes, insuffisante pour une maison de plus de 70 m²."", ""Aspiration faible sur tapis, laisse des miettes et poils d'animaux."", ""Réservoir d'eau sale de 600 ml à vider toutes les 10 minutes en usage continu."", ""Brosses qui s'emmêlent facilement avec les cheveux, nécessitant un nettoyage manuel régulier.""]","{""Design"": 8.5, ""Qualité"": 8.0, ""Polyvalence"": 7.0, ""Qualité/Prix"": 7.0, ""Facilité d'utilisation"": 7.5}","Le Bissell CrossWave Cordless Max est un aspirateur-balai laveur sans fil qui se positionne comme une solution 2-en-1 pour nettoyer sols durs et tapis. Il promet de remplacer à la fois l'aspirateur et la serpillière, avec une autonomie annoncée de 30 minutes. Basé sur les retours utilisateurs, les performances réelles sont mitigées : le nettoyage des sols durs est correct, mais l'aspiration sur tapis est décevante, laissant souvent des résidus. L'autonomie réelle est plutôt de 20 minutes en mode normal, et la batterie met 4 heures à se recharger. Le réservoir d'eau sale est petit (600 ml) et nécessite des vidanges fréquentes. L'entretien est contraignant : les brosses s'emmêlent facilement avec les cheveux, et le nettoyage du réservoir est fastidieux. Côté prix, il est vendu autour de 300 €, ce qui le place dans le haut de gamme des aspirateurs sans fil, mais ses performances ne justifient pas ce tarif. En résumé, c'est un produit pratique pour les petits espaces avec sols durs, mais décevant pour les tapis et les grandes surfaces.","{""Amazon"": {""url"": ""https://www.amazon.fr/dp/B098KLVY75?tag=troviio-21"", ""inStock"": true, ""priceEur"": 450, ""merchantName"": ""Amazon""}}",True
Aspirateur balai,aspirateur-balai,15,Shark,Stratos Corded Stick,shark-hz500eu-avec-fil,B08M3PXCRQ,69,https://m.media-amazon.com/images/I/41ZbW0DPazL.jpg,https://www.amazon.fr/dp/B08M3PXCRQ?tag=troviio-21,8.0,"Idéal pour les foyers avec animaux ou cheveux longs cherchant une aspiration puissante et sans fil à couper, à condition d'accepter le filaire et un poids modéré. À environ 200-250 €, c'est un bon choix pour un usage quotidien sur sols mixtes.","L'aspirateur balai filaire le plus puissant de Shark, conçu pour les propriétaires d'animaux avec une technologie anti-emmêlement et un neutraliseur d'odeurs.","{""GARANTIE DE 5 ANS"": ""Après inscription auprès de Shark"", ""SE PLIE POUR QUE VOUS N&#39;AYEZ PAS À LE FAIRE"": ""Le tube Flexology se plie pour atteindre n&#39;importe quel endroit, nettoie facilement sous les meubles et se replie pour un rangement compact et autonome""}","[""Technologie DuoClean avec deux brosses motorisées pour un nettoyage efficace sur moquette et sols durs."", ""Système anti-enroulement des cheveux qui élimine les poils longs et courts sans intervention manuelle."", ""Mode Flexology pliable pour nettoyer sous les meubles bas (lits, canapés) à un bouton."", ""Transformation en aspirateur à main léger pour les escaliers, meubles et voitures."", ""Câble de 10 mètres offrant une grande portée sans changer de prise.""]","[""Poids de 3,9 kg, ce qui peut fatiguer lors d'un nettoyage prolongé en mode balai."", ""Absence de batterie (filaire) limitant la mobilité et nécessitant une prise à proximité."", ""Capacité du réservoir à poussière non précisée, mais jugée petite par certains utilisateurs, nécessitant des vidanges fréquentes."", ""Le format balai peut être encombrant pour le rangement dans de petits espaces.""]","{""Design"": 8.5, ""Qualité"": 8.0, ""Polyvalence"": 7.0, ""Qualité/Prix"": 7.0, ""Facilité d'utilisation"": 7.5}","Le Shark Stratos Corded Stick est un aspirateur balai filaire conçu pour offrir une polyvalence sur moquette et sols durs. Il intègre la technologie DuoClean avec deux brosses motorisées, un système anti-enroulement des cheveux, et un mode pliable Flexology pour nettoyer sous les meubles bas. Avec une note de 4,2/5 sur 1 870 avis Amazon, il se distingue par sa puissance d'aspiration constante (filaire) et sa capacité à se transformer en aspirateur à main. Cependant, son poids de 3,9 kg et son format balai peuvent limiter la maniabilité pour certains utilisateurs. Le câble de 10 mètres offre une bonne portée, mais l'absence de batterie le rend moins pratique pour les grands espaces sans prises. Ce modèle convient particulièrement aux foyers avec animaux ou cheveux longs, grâce à son anti-enroulement efficace. En revanche, le réservoir pourrait être plus grand pour éviter des vidanges fréquentes. Le verdict : un bon rapport qualité-prix pour un usage domestique intensif, surtout si le filaire ne vous dérange pas.","{""Amazon"": {""url"": ""https://www.amazon.fr/dp/B08M3PXCRQ?tag=troviio-21"", ""inStock"": true, ""priceEur"": 69, ""merchantName"": ""Amazon""}}",True
Aspirateur balai,aspirateur-balai,16,Dreame,Z30,dreame-z30,B0D6ZB7CMY,500,https://m.media-amazon.com/images/I/B0D6ZB7CMY._SL1500_.jpg,https://www.amazon.fr/dp/B0D6ZB7CMY?tag=troviio-21,8.0,"Ce modèle est idéal pour les grands logements grâce à son autonomie titanesque et son mode Auto pertinent. Il offre une excellente polyvalence avec de nombreux accessoires et un entretien facilité. Cependant, son aspiration peut montrer des limites sur certains types de sols et son écran est jugé un peu chargé. C'est un très bon choix pour ceux qui cherchent une alternative performante aux grandes marques, à condition d'accepter quelques compromis sur la finition.",Le Dreame Z30 est un aspirateur balai sans fil haut de gamme qui rivalise avec les ténors du marché grâce à une puissance d'aspiration élevée et une autonomie impressionnante.,"{""type"": ""sans_fil"", ""annee"": 2025, ""design"": ""standard"", ""parquet"": true, ""segment"": ""premium"", ""moquette"": true, ""poids_kg"": 2.8, ""ecran_lcd"": true, ""ergonomie"": ""gachette_clic"", ""filtration"": ""HEPA"", ""application"": false, ""mini_turbine"": true, ""aspiration_AW"": 210, ""aspiration_Pa"": 28000, ""autonomie_min"": 90, ""batterie_type"": ""Li-Ion"", ""capteur_laser"": false, ""poils_animaux"": true, ""tube_flexible"": false, ""alerte_troviio"": ""Nouveau 2025 — Classé #2 par Capital.fr/Numerama. Activer dès que budget < 600€ et performances Dyson voulues. HEPA H13 = arme majeure."", ""anti_allergene"": true, ""brosse_animaux"": true, ""brosse_parquet"": true, ""reservoir_vide"": ""cyclone_sans_contact"", ""brosse_fissures"": true, ""detection_laser"": false, ""convertible_main"": true, ""detecte_type_sol"": true, ""temps_charge_min"": 220, ""brosse_principale"": ""motorisee_anti_emmellement"", ""detecte_poussiere"": true, ""filtration_niveau"": ""H13"", ""profil_recommande"": [""meilleure_alternative_dyson"", ""grande_maison_budget"", ""animaux_moquette_budget""], ""batteries_incluses"": 1, ""puissance_moteur_W"": 600, ""poids_corps_seul_kg"": 1.8, ""batterie_remplacable"": true, ""capacite_reservoir_L"": 0.65, ""couleurs_disponibles"": [""noir_carbone"", ""argent""], ""coût_3ans_estime_eur"": 700, ""duree_vie_estimee_ans"": 5, ""nb_accessoires_inclus"": 5, ""autonomie_mode_max_min"": 8, ""gating_rules_specifiques"": [""GR-ASPI-004""]}","[""Autonomie exceptionnelle, idéale pour les grandes surfaces"", ""Mode Auto pertinent qui adapte la puissance d'aspiration"", ""Nombreux accessoires inclus pour une grande polyvalence"", ""Entretien facilité avec des éléments lavables""]","[""Puissance d'aspiration perfectible sur certains types de sols"", ""Écran d'affichage jugé un peu chargé et complexe""]","{""Design"": 8.5, ""Qualité"": 8.0, ""Polyvalence"": 8.0, ""Qualité/Prix"": 7.5, ""Facilité d'utilisation"": 7.5}","**Synthèse des tests du Dreame Z30**   Le Dreame Z30 est salué par **Les Numériques** pour ses performances d’aspiration élevées et son autonomie satisfaisante, mais regrette un prix jugé élevé face à la concurrence. **01net** souligne son excellent rapport qualité-prix, notamment grâce à son moteur puissant et sa filtration avancée, tout en notant un niveau sonore un peu fort. Enfin, **Que Choisir** met en avant sa polyvalence et sa bonne finition, mais pointe un système de fixation du réservoir perfectible.","{""Amazon"": {""url"": ""https://www.amazon.fr/dp/B0D6ZB7CMY?tag=troviio-21"", ""inStock"": true, ""priceEur"": 550, ""merchantName"": ""Amazon""}}",True
Aspirateur balai,aspirateur-balai,17,Tineco,FLOOR ONE S7 Stretch Ultra,tineco-tineco-floor-one-s7-stretch-ultra,B0DPPLWYGX,349,https://m.media-amazon.com/images/I/11QJHWSjWML._SL1500_.jpg,https://www.amazon.fr/dp/B0DPPLWYGX?tag=troviio-21,8.0,"Idéal pour les propriétaires de sols durs cherchant un nettoyage rapide et hygiénique avec séchage intégré, mais à éviter si vous avez de grands tapis ou une sensibilité au bruit. À environ 400-500 €, il offre un bon rapport qualité-prix pour une utilisation quotidienne.",Le Tineco FLOOR ONE S7 Stretch Ultra est un aspirateur balai laveur haut de gamme qui combine aspiration puissante et nettoyage à la vapeur pour un résultat impeccable.,"{""Technologie Tineco MHCBS"": ""Un sol complètement propre avec un lavage continu à l&#39;eau douce et un recyclage efficace des eaux sales, à une fréquence constante de 450 tours/min."", ""Conception de plat à 180°"": ""Aspirateur Laveur, s&#39;incline sans effort jusqu&#39;à 180°, permettant de passer facilement sous les meubles ou dans les zones basses pour nettoyer la poussière cachée.""}","[""Séchage Flashdry à 85°C en 5 minutes, réduisant les risques de moisissures et d'odeurs."", ""Plat à 180° permettant de nettoyer sous les meubles bas (hauteur de passage de 13 cm)."", ""Autonomie de 50 minutes (annoncée) sur sol dur, suffisante pour une maison de 100 m²."", ""Nettoyage des coins amélioré sur deux côtés, réduisant les zones non nettoyées."", ""Système iLoop ajustant automatiquement l'eau et la puissance en fonction du niveau de saleté.""]","[""Autonomie réelle d'environ 35-40 minutes en mode standard, inférieure à l'annonce."", ""Bruit de 78 dB, comparable à un aspirateur classique, pouvant être gênant."", ""Poids de 4,5 kg, rendant l'utilisation prolongée fatigante."", ""Temps de charge de 4,5 heures, long pour une utilisation quotidienne.""]","{""Design"": 8.5, ""Qualité"": 8.0, ""Polyvalence"": 7.0, ""Qualité/Prix"": 7.0, ""Facilité d'utilisation"": 7.5}","Le Tineco FLOOR ONE S7 Stretch Ultra est un aspirateur-balai sans fil 2-en-1 conçu pour le nettoyage quotidien des sols durs. Avec une autonomie annoncée de 50 minutes et un réservoir d'eau claire de 1 L, il permet de couvrir de grandes surfaces sans recharge. Sa fonction Flashdry chauffe le rouleau à 85°C en 5 minutes pour un séchage rapide et hygiénique, tandis que le passage à 180° facilite l'accès sous les meubles bas. Le nettoyage des coins est amélioré sur deux côtés, et le système iLoop ajuste automatiquement l'eau et la puissance selon le niveau de saleté. Les retours clients (4,2/5 sur 1792 avis) soulignent une bonne efficacité sur les sols durs, mais certains mentionnent une autonomie réelle inférieure (environ 35-40 minutes en mode standard) et un bruit de 78 dB. Le poids de 4,5 kg peut être fatigant pour une utilisation prolongée. Le S7 Stretch Ultra se distingue par son séchage rapide et son design anti-emmêlement, mais le temps de charge de 4,5 heures et l'absence de mode tapis limitent son usage.","{""Amazon"": {""url"": ""https://www.amazon.fr/dp/B0DPPLWYGX?tag=troviio-21"", ""inStock"": true, ""priceEur"": 349, ""merchantName"": ""Amazon""}}",True
Aspirateur balai,aspirateur-balai,18,Dyson,Outsize Absolute,dyson-outsize,B096YJD3NN,159,https://m.media-amazon.com/images/I/41ZbW0DPazL.jpg,https://www.amazon.fr/dp/B096YJD3NN?tag=troviio-21,8.0,"Idéal pour les grandes surfaces avec moquette et animaux, mais trop lourd et cher pour les petits appartements ou les budgets limités.","Le Dyson Outsize Absolute est un aspirateur balai surdimensionné conçu pour les grandes surfaces, offrant une puissance d'aspiration élevée et un grand réservoir.","{""type"": ""sans_fil"", ""annee"": 2024, ""design"": ""xxl"", ""parquet"": true, ""segment"": ""ultra_premium"", ""moquette"": true, ""poids_kg"": 3.56, ""ecran_lcd"": true, ""ergonomie"": ""gachette_continue"", ""filtration"": ""HEPA"", ""application"": false, ""mini_turbine"": true, ""aspiration_AW"": 220, ""aspiration_Pa"": 32000, ""autonomie_min"": 120, ""batterie_type"": ""Li-Ion"", ""capteur_laser"": false, ""poils_animaux"": true, ""tube_flexible"": false, ""alerte_troviio"": ""ACTIVER si surface > 150m² et besoin de remplacer un aspirateur traîneau. Bac 1.9L = unique sur le marché."", ""anti_allergene"": true, ""brosse_animaux"": true, ""brosse_parquet"": true, ""reservoir_vide"": ""cyclone_sans_contact"", ""brosse_fissures"": true, ""detection_laser"": false, ""convertible_main"": true, ""detecte_type_sol"": true, ""temps_charge_min"": 270, ""brosse_principale"": ""motorisee_xxl"", ""detecte_poussiere"": false, ""filtration_niveau"": ""H13"", ""profil_recommande"": [""grande_maison_200m2"", ""plusieurs_etages"", ""remplacement_traineau""], ""batteries_incluses"": 2, ""puissance_moteur_W"": 660, ""poids_corps_seul_kg"": 2.2, ""batterie_remplacable"": true, ""capacite_reservoir_L"": 1.9, ""couleurs_disponibles"": [""rouge"", ""nickel""], ""coût_3ans_estime_eur"": 950, ""duree_vie_estimee_ans"": 9, ""nb_accessoires_inclus"": 6, ""autonomie_mode_max_min"": 10, ""gating_rules_specifiques"": [""GR-ASPI-002"", ""GR-ASPI-007""]}","[""Puissance d'aspiration très élevée, mesurée à 230 AW, surpassant la plupart des aspirateurs balais."", ""Autonomie réelle de 45 minutes en mode standard, suffisante pour nettoyer 150 m² sans recharge."", ""Grand réservoir de 0,77 L, réduisant la fréquence de vidange lors du nettoyage de grandes surfaces."", ""Filtration HEPA certifiée, capturant 99,97% des particules fines, idéal pour les allergiques."", ""Rouleau nettoyeur anti-enroulement efficace, ne nécessitant pas de coupe des cheveux.""]","[""Poids lourd de 3,1 kg en main, fatiguant pour un usage prolongé ou en hauteur."", ""Prix élevé d'environ 800 €, bien au-dessus de la moyenne des aspirateurs balais."", ""Station de charge encombrante nécessitant un perçage mural, peu pratique en location."", ""Conversion en aspirateur à main peu intuitive, nécessitant de retirer le tube et le rouleau.""]","{""Design"": 8.5, ""Qualité"": 8.0, ""Polyvalence"": 7.0, ""Qualité/Prix"": 7.0, ""Facilité d'utilisation"": 7.5}","Le Dyson Outsize Absolute est un aspirateur balai sans fil haut de gamme, positionné comme le modèle le plus puissant et le plus grand de la gamme Dyson. Il cible les grandes surfaces (jusqu'à 150 m²) et les utilisateurs exigeants en matière de performance et d'autonomie. Les retours utilisateurs soulignent une aspiration exceptionnelle, comparable à un aspirateur traîneau, grâce au moteur numérique Dyson Hyperdymium. Le grand réservoir (0,77 L) et la batterie longue durée (jusqu'à 60 minutes en mode standard) sont très appréciés. Cependant, le poids (3,1 kg en main) et le prix élevé (environ 800 €) sont des freins. Le système de filtration HEPA est efficace pour les allergènes. Le rouleau nettoyeur anti-enroulement fonctionne bien sur les tapis. En revanche, la station de charge murale est imposante, et le passage en mode aspirateur à main nécessite de démonter le tube. Le rapport qualité-prix est discutable face à des concurrents comme le Samsung Jet 90 ou le LG CordZero. Verdict : excellent pour les grandes maisons avec moquette et animaux, mais trop lourd et cher pour les petits espaces ou les budgets serrés.","{""Amazon"": {""url"": ""https://www.amazon.fr/dp/B096YJD3NN?tag=troviio-21"", ""inStock"": true, ""priceEur"": 159, ""merchantName"": ""Amazon""}}",True
Aspirateur balai,aspirateur-balai,19,Dyson,V12 Detect Slim Absolute,dyson-v12-detect-slim,B0CK74L5RN,799,https://m.media-amazon.com/images/I/41ZbW0DPazL.jpg,https://www.amazon.fr/dp/B0CK74L5RN?tag=troviio-21,8.0,"Ce produit est idéal pour les propriétaires de petits espaces avec sols durs et budget conséquent, mais pas pour les grandes surfaces ou les tapis épais nécessitant une autonomie prolongée.","Le Dyson V12 Detect Slim Absolute est un aspirateur balai sans fil ultra-léger et compact, conçu pour offrir une puissance d'aspiration élevée avec un confort d'utilisation optimal.","{""type"": ""sans_fil"", ""annee"": 2024, ""design"": ""slim"", ""parquet"": true, ""segment"": ""premium"", ""moquette"": true, ""poids_kg"": 2.2, ""ecran_lcd"": true, ""ergonomie"": ""interrupteur"", ""filtration"": ""HEPA"", ""application"": false, ""mini_turbine"": true, ""aspiration_AW"": 150, ""aspiration_Pa"": 24000, ""autonomie_min"": 60, ""batterie_type"": ""Li-Ion"", ""capteur_laser"": true, ""poils_animaux"": true, ""tube_flexible"": false, ""alerte_troviio"": ""Bac 0.35L = le plus petit de la gamme Dyson. Exclure si grande surface > 100m² (vidage trop fréquent)."", ""anti_allergene"": true, ""brosse_animaux"": true, ""brosse_parquet"": true, ""reservoir_vide"": ""cyclone_sans_contact"", ""brosse_fissures"": true, ""detection_laser"": true, ""convertible_main"": true, ""detecte_type_sol"": true, ""temps_charge_min"": 240, ""brosse_principale"": ""laser_detect"", ""detecte_poussiere"": true, ""filtration_niveau"": ""H13"", ""profil_recommande"": [""parquet_principal"", ""senior"", ""poids_critique"", ""maniaque_proprete""], ""batteries_incluses"": 1, ""puissance_moteur_W"": 545, ""poids_corps_seul_kg"": 1.5, ""batterie_remplacable"": true, ""capacite_reservoir_L"": 0.35, ""couleurs_disponibles"": [""jaune"", ""fer""], ""coût_3ans_estime_eur"": 700, ""duree_vie_estimee_ans"": 8, ""nb_accessoires_inclus"": 5, ""autonomie_mode_max_min"": 5, ""gating_rules_specifiques"": [""GR-ASPI-005"", ""GR-ASPI-009""]}","[""Laser vert intégré au suceur pour sols durs révélant jusqu'à 2 fois plus de poussière invisible que les modèles sans laser."", ""Capteur piézoélectrique affichant en temps réel la taille et le nombre de particules aspirées, avec un compteur de particules."", ""Poids ultra-léger de 2,2 kg, facilitant le nettoyage en hauteur et les déplacements."", ""Filtration HEPA certifiée piégeant 99,97% des particules fines, idéale pour les allergiques."", ""Autonomie de 40 minutes en mode standard, suffisante pour un appartement de 60 m².""]","[""Autonomie réduite à 10-15 minutes en mode boost, insuffisante pour un nettoyage intensif."", ""Réservoir à poussière de seulement 0,3 litre, nécessitant des vidanges fréquentes lors de l'aspiration de gros volumes."", ""Prix élevé d'environ 600 €, le rendant moins compétitif face à des modèles équivalents moins chers."", ""Bouton de déverrouillage du bac jugé fragile par certains utilisateurs, avec des risques de casse après quelques mois d'usage.""]","{""Design"": 8.5, ""Qualité"": 8.0, ""Polyvalence"": 7.0, ""Qualité/Prix"": 7.0, ""Facilité d'utilisation"": 7.5}","Le Dyson V12 Detect Slim Absolute se positionne comme un aspirateur balai haut de gamme, conçu pour les foyers recherchant légèreté et technologie avancée. Avec un poids de 2,2 kg et un design compact, il cible les utilisateurs soucieux de la propreté des sols durs et des tapis fins. Les retours utilisateurs soulignent une puissance d'aspiration constante de 150 AW, grâce au moteur numérique Dyson V12, et une autonomie réelle de 30 à 40 minutes en mode standard, suffisante pour un appartement de 60 m². Le laser vert intégré au suceur pour sols durs révèle efficacement la poussière invisible, tandis que le capteur piézoélectrique affiche en temps réel la taille des particules aspirées. Cependant, l'autonomie chute à 10-15 minutes en mode boost, et le réservoir de 0,3 litre nécessite des vidanges fréquentes. Le prix élevé (environ 600 €) le rend moins accessible, et certains utilisateurs rapportent une fragilité du bouton de déverrouillage du bac. En termes de qualité, la filtration HEPA certifiée piège 99,97% des allergènes, un atout pour les allergiques. L'usage quotidien est facilité par la station de charge murale et la transformation en aspirateur à main. En résumé, le Dyson V12 Detect Slim Absolute est un outil précis pour les sols durs, mais son autonomie limitée et son coût le réservent aux petits espaces et aux budgets conséquents.","{""Amazon"": {""url"": ""https://www.amazon.fr/dp/B0CK74L5RN?tag=troviio-21"", ""inStock"": true, ""priceEur"": 799, ""merchantName"": ""Amazon""}}",True
