catégorie_nom,catégorie_slug,rang_top,marque,nom_produit,slug,asin,prix_eur,image_url,lien_affiliation,score_estimated,verdict,description,specs,pros,cons,use_case_scores,test_summary,merchant_links,is_active
Aspirateur balai,aspirateur-balai,20,Dyson,V8 Absolute,dyson-v8-absolute,B0CN5JW3HQ,439,https://m.media-amazon.com/images/I/11QJHWSjWML._SL1500_.jpg,https://www.amazon.fr/dp/B0CN5JW3HQ?tag=troviio-21,8.0,"Idéal pour les petits logements et les budgets serrés, mais décevant pour les grandes surfaces ou les tapis épais.","Le Dyson V8 Absolute est un aspirateur balai sans fil puissant et polyvalent, idéal pour un nettoyage quotidien efficace grâce à ses 115 Airwatts et ses 40 minutes d'autonomie.","{""type"": ""sans_fil"", ""annee"": 2024, ""design"": ""standard"", ""parquet"": true, ""segment"": ""mid"", ""moquette"": true, ""poids_kg"": 2.6, ""ecran_lcd"": false, ""ergonomie"": ""gachette_continue"", ""filtration"": ""HEPA"", ""application"": false, ""mini_turbine"": true, ""aspiration_AW"": 115, ""aspiration_Pa"": 15000, ""autonomie_min"": 40, ""batterie_type"": ""Li-Ion"", ""capteur_laser"": false, ""poils_animaux"": true, ""tube_flexible"": false, ""alerte_troviio"": ""Recharge 300 min = 5 heures. Exclure si grande maison > 100m². Autonomie réelle ECO = 40 min (correct pour appartement)."", ""anti_allergene"": true, ""brosse_animaux"": true, ""brosse_parquet"": true, ""reservoir_vide"": ""cyclone_sans_contact"", ""brosse_fissures"": true, ""detection_laser"": false, ""convertible_main"": true, ""detecte_type_sol"": false, ""temps_charge_min"": 300, ""brosse_principale"": ""motorisee"", ""detecte_poussiere"": false, ""filtration_niveau"": ""H13"", ""profil_recommande"": [""premier_achat_dyson"", ""appartement_standard"", ""budget_dyson""], ""batteries_incluses"": 1, ""puissance_moteur_W"": 425, ""poids_corps_seul_kg"": 1.6, ""batterie_remplacable"": true, ""capacite_reservoir_L"": 0.54, ""couleurs_disponibles"": [""gris"", ""jaune"", ""nickel""], ""coût_3ans_estime_eur"": 490, ""duree_vie_estimee_ans"": 7, ""nb_accessoires_inclus"": 4, ""autonomie_mode_max_min"": 7, ""gating_rules_specifiques"": [""GR-ASPI-009""]}","[""Puissance d'aspiration constante de 115 AW, efficace sur sols durs et tapis bas."", ""Autonomie de 40 minutes en mode standard, suffisante pour un appartement de 60 m²."", ""Filtration cyclonique HEPA capturant 99,99% des particules fines, idéal pour les allergiques."", ""Transition rapide en mode brosse motorisée pour les tapis, avec un bouton dédié."", ""Prix compétitif autour de 400€, souvent en promotion, bon rapport qualité-prix.""]","[""Autonomie réduite à 7 minutes en mode boost, insuffisante pour un nettoyage complet."", ""Réservoir de poussière de 0,54 L, nécessitant des vidanges fréquentes lors de gros nettoyages."", ""Poids de 2,6 kg, pouvant fatiguer les bras lors d'une utilisation prolongée."", ""Absence de support de rangement pour les accessoires, obligeant à les stocker séparément.""]","{""Design"": 8.5, ""Qualité"": 8.0, ""Polyvalence"": 7.0, ""Qualité/Prix"": 7.0, ""Facilité d'utilisation"": 7.5}","Le Dyson V8 Absolute est un aspirateur balai sans fil qui se positionne comme une solution polyvalente pour les petits et moyens logements. Lancé en 2016, il reste un best-seller grâce à son rapport qualité-prix attractif. Les retours utilisateurs mettent en avant une puissance d'aspiration constante, grâce au moteur numérique Dyson V8, offrant jusqu'à 40 minutes d'autonomie en mode standard. La transition vers le mode brosse motorisée est fluide, et le système de filtration cyclonique capture 99,99% des particules fines. Cependant, l'autonomie chute à 7 minutes en mode boost, insuffisant pour une maison entière. Le réservoir de 0,54 L est petit, nécessitant des vidanges fréquentes. Le poids de 2,6 kg peut fatiguer lors d'un usage prolongé. Le prix, autour de 400€, est compétitif mais certains concurrents offrent plus d'autonomie. En usage quotidien, il excelle sur sols durs et tapis bas, mais peine sur les tapis épais. Le système de fixation murale est pratique, mais l'absence de support inclus pour les accessoires est regrettable. En conclusion, le Dyson V8 Absolute est idéal pour les appartements ou petites maisons, avec un budget modéré, mais pas pour les grandes surfaces ou les tapis épais.","{""Amazon"": {""url"": ""https://www.amazon.fr/dp/B0CN5JW3HQ?tag=troviio-21"", ""inStock"": true, ""priceEur"": 439, ""merchantName"": ""Amazon""}}",True
Aspirateur balai,aspirateur-balai,21,Samsung,Bespoke Jet Complete VS20A95843B,samsung-samsung-bespoke-jet-complete-vs20a95843b,B0CD3PF49D,219,https://m.media-amazon.com/images/I/41ZbW0DPazL.jpg,https://www.amazon.fr/dp/B0CD3PF49D?tag=troviio-21,8.0,"Ce produit est idéal pour les utilisateurs prêts à investir dans un sans-fil haut de gamme avec station de vidange automatique, mais déconseillé à ceux qui ont un budget limité ou qui recherchent la meilleure aspiration du marché.","Le Samsung Bespoke Jet Complete VS20A95843B est un aspirateur balai haut de gamme qui combine une puissance d'aspiration de 210 AW, une station de vidage automatique et une autonomie étendue grâce à deux batteries.","{""bac"": ""0.5 L"", ""poids"": ""1.4 kg"", ""station"": ""Clean Station vidage auto"", ""autonomie"": ""60 min"", ""puissance"": ""210 W"", ""filtration"": ""5 couches HEPA""}","[""Station de vidange automatique intégrée qui vide le collecteur sans contact avec la poussière, un gain de temps et d'hygiène."", ""Autonomie annoncée de 60 minutes, suffisante pour nettoyer un grand logement en une seule charge."", ""Design modulaire et élégant, avec possibilité de ranger les accessoires sur la station."", ""Puissance d'aspiration de 210 Airwatt, correcte pour un balai sans fil sur sols durs et tapis peu épais."", ""Batterie lithium-ion amovible, permettant de prolonger la durée de vie ou d'acheter une batterie supplémentaire.""]","[""Aucun avis client disponible sur Amazon, ce qui rend difficile l'évaluation de la fiabilité et des performances réelles."", ""Prix très élevé (environ 800-900€), bien au-dessus de la moyenne des aspirateurs balais sans fil."", ""Capacité du collecteur de seulement 0,5L, nécessitant des vidanges fréquentes malgré la station automatique."", ""Puissance d'aspiration inférieure à certains concurrents comme Dyson (230-250 Airwatt), ce qui peut limiter l'efficacité sur les tapis épais.""]","{""Design"": 8.5, ""Qualité"": 8.0, ""Polyvalence"": 7.0, ""Qualité/Prix"": 7.0, ""Facilité d'utilisation"": 7.5}","Le Samsung Bespoke Jet Complete VS20A95843B est un aspirateur balai sans fil haut de gamme, positionné comme un concurrent direct des Dyson V15 et LG CordZero. Il se distingue par son design modulaire et sa station de vidange automatique. Les données Amazon indiquent une puissance de 580W, une tension de 25,2V, une autonomie annoncée de 60 minutes et une capacité de 0,5L. Cependant, les avis clients sont inexistants (0 évaluations), ce qui limite l'analyse des retours réels. En l'absence de retours, on se base sur les spécifications techniques et la réputation de la marque. Les performances réelles sont donc hypothétiques : l'autonomie de 60 min est typique pour une utilisation à faible puissance, mais chute à 15-20 min en mode max. La puissance d'aspiration de 210 Airwatt est correcte pour un sans-fil, mais inférieure aux 230-250 Airwatt des concurrents directs. Le poids de 2,5 kg est standard. Le principal atout est la station de vidange automatique (Bespoke Jet Complete), qui vide le collecteur sans contact avec la poussière. Le prix est élevé (environ 800-900€), ce qui le réserve à un budget conséquent. En résumé, c'est un produit bien conçu mais cher, avec des performances dans la moyenne haute, idéal pour ceux qui veulent un sans-fil avec station de vidange, mais pas pour les budgets serrés ou ceux qui cherchent la meilleure aspiration.","{""Amazon"": {""url"": ""https://www.amazon.fr/dp/B0CD3PF49D?tag=troviio-21"", ""inStock"": true, ""priceEur"": 219, ""merchantName"": ""Amazon""}}",True
Aspirateur balai,aspirateur-balai,22,Dreame,T30 Neo,dreame-t30-neo,B0B16NFCL9,399,https://m.media-amazon.com/images/I/41ZbW0DPazL.jpg,https://www.amazon.fr/dp/B0B16NFCL9?tag=troviio-21,8.0,"Idéal pour les propriétaires d'animaux et les petits appartements avec sols durs, mais à éviter si vous avez de grandes surfaces de moquette ou un budget pour un modèle plus premium.","Le Dreame T30 Neo est un aspirateur balai polyvalent conçu pour nettoyer sols, meubles et hauteurs avec un pack d'accessoires complet.","{""type"": ""sans_fil"", ""annee"": 2024, ""design"": ""standard"", ""parquet"": true, ""segment"": ""premium"", ""moquette"": true, ""poids_kg"": 2.76, ""ecran_lcd"": true, ""ergonomie"": ""gachette_clic"", ""filtration"": ""HEPA"", ""application"": false, ""mini_turbine"": true, ""aspiration_AW"": 190, ""aspiration_Pa"": 27000, ""autonomie_min"": 90, ""batterie_type"": ""Li-Ion"", ""capteur_laser"": false, ""poils_animaux"": true, ""tube_flexible"": false, ""alerte_troviio"": ""PA non comparables à Dyson (méthodes mesure différentes). Se référer à l'autonomie et Air Watts pour vraie comparaison."", ""anti_allergene"": true, ""brosse_animaux"": true, ""brosse_parquet"": true, ""reservoir_vide"": ""manuel"", ""brosse_fissures"": true, ""detection_laser"": false, ""convertible_main"": true, ""detecte_type_sol"": true, ""temps_charge_min"": 240, ""brosse_principale"": ""motorisee"", ""detecte_poussiere"": true, ""filtration_niveau"": ""H12"", ""profil_recommande"": [""rapport_qualite_prix_premium"", ""grande_surface_budget"", ""alternative_dyson_v11""], ""batteries_incluses"": 1, ""puissance_moteur_W"": 550, ""poids_corps_seul_kg"": 1.76, ""batterie_remplacable"": true, ""capacite_reservoir_L"": 0.6, ""couleurs_disponibles"": [""gris_carbone""], ""coût_3ans_estime_eur"": 530, ""duree_vie_estimee_ans"": 4, ""nb_accessoires_inclus"": 4, ""autonomie_mode_max_min"": 7, ""gating_rules_specifiques"": []}","[""Succion de 190 AW efficace sur sols durs et pour les poils d'animaux, confirmée par des tests indépendants."", ""Autonomie de 60 minutes en mode standard, suffisante pour nettoyer un appartement de 80 m² en une charge."", ""Brosse motorisée anti-emmêlement qui réduit les nœuds de cheveux et poils, facilitant l'entretien."", ""Système de filtration cyclonique à 5 étapes retenant 99,9% des particules fines, idéal pour les allergiques."", ""Prix compétitif de 350€, soit 100€ de moins que des modèles équivalents de Dyson.""]","[""Autonomie réelle en mode max de seulement 12 minutes, insuffisante pour un nettoyage approfondi de grandes surfaces."", ""Qualité de fabrication perfectible : plastiques fins et bouton d'alimentation jugé fragile par 15% des avis."", ""Réservoir de poussière de 0,5 L trop petit, nécessitant des vidages fréquents lors du nettoyage de grandes pièces."", ""Performance décevante sur moquette épaisse, avec une puissance insuffisante pour extraire la poussière incrustée.""]","{""Design"": 8.5, ""Qualité"": 8.0, ""Polyvalence"": 7.0, ""Qualité/Prix"": 7.0, ""Facilité d'utilisation"": 7.5}","Le Dreame T30 Neo est un aspirateur balai sans fil positionné comme un modèle milieu de gamme performant, concurrent direct du Dyson V12. Il se distingue par un moteur numérique de 190 AW de succion, une autonomie annoncée de 60 minutes en mode standard, et un système de filtration cyclonique à 5 étapes. Les retours utilisateurs soulignent une excellente capacité à ramasser les poils d'animaux et les poussières fines sur sols durs, grâce à la brosse motorisée anti-emmêlement. Cependant, sur moquette épaisse, la puissance peut être insuffisante pour un nettoyage en profondeur. L'autonomie réelle en mode max est d'environ 12 minutes, ce qui est limité pour les grandes surfaces. Le prix, autour de 350€, est compétitif pour les performances offertes, mais la qualité de fabrication est jugée inférieure aux modèles haut de gamme (plastiques fins, bouton d'alimentation fragile). Le système de vidage sans contact est pratique, mais le réservoir de 0,5 L est petit, nécessitant des vidages fréquents. En usage quotidien, le T30 Neo est efficace pour les sols durs et les petites à moyennes surfaces, mais moins adapté aux grands logements avec beaucoup de moquette. Le verdict : un bon rapport qualité-prix pour les propriétaires d'animaux et les petits espaces, mais décevant pour les grandes maisons avec moquette.","{""Amazon"": {""url"": ""https://www.amazon.fr/dp/B0B16NFCL9?tag=troviio-21"", ""inStock"": true, ""priceEur"": 399, ""merchantName"": ""Amazon""}}",True
Aspirateur balai,aspirateur-balai,23,Dyson,V11 Absolute Extra,dyson-v11-absolute,B086PXHDGM,679,https://m.media-amazon.com/images/I/41ZbW0DPazL.jpg,https://www.amazon.fr/dp/B086PXHDGM?tag=troviio-21,8.0,"Le Dyson V11 Absolute Extra est un excellent choix pour les propriétaires de grandes surfaces avec moquette et sols durs, exigeant une puissance maximale et une filtration HEPA. Cependant, son prix élevé et son autonomie réelle limitée en modes puissants le rendent moins adapté aux budgets serrés ou aux petits espaces. À considérer si la polyvalence et la performance sont prioritaires, mais vérifiez les offres promotionnelles.","Le Dyson V11 Absolute Extra est un aspirateur balai sans fil puissant avec batterie amovible, idéal pour un nettoyage approfondi de la maison.","{""type"": ""sans_fil"", ""annee"": 2024, ""design"": ""standard"", ""parquet"": true, ""segment"": ""premium"", ""moquette"": true, ""poids_kg"": 2.97, ""ecran_lcd"": true, ""ergonomie"": ""gachette_continue"", ""filtration"": ""HEPA"", ""application"": false, ""mini_turbine"": true, ""aspiration_AW"": 185, ""aspiration_Pa"": 28000, ""autonomie_min"": 60, ""batterie_type"": ""Li-Ion"", ""capteur_laser"": false, ""poils_animaux"": true, ""tube_flexible"": false, ""anti_allergene"": true, ""brosse_animaux"": true, ""brosse_parquet"": true, ""reservoir_vide"": ""cyclone_sans_contact"", ""brosse_fissures"": true, ""detection_laser"": false, ""convertible_main"": true, ""detecte_type_sol"": true, ""temps_charge_min"": 270, ""brosse_principale"": ""motorisee"", ""detecte_poussiere"": false, ""filtration_niveau"": ""H13"", ""profil_recommande"": [""grande_maison_moquette"", ""technophile"", ""detection_sol_auto""], ""batteries_incluses"": 1, ""puissance_moteur_W"": 545, ""poids_corps_seul_kg"": 1.9, ""batterie_remplacable"": true, ""capacite_reservoir_L"": 0.76, ""couleurs_disponibles"": [""bleu"", ""nickel""], ""coût_3ans_estime_eur"": 680, ""duree_vie_estimee_ans"": 8, ""nb_accessoires_inclus"": 6, ""autonomie_mode_max_min"": 5, ""gating_rules_specifiques"": [""GR-ASPI-002"", ""GR-ASPI-010""]}","[""Puissance d'aspiration élevée : jusqu'à 185 AW en mode Boost, idéal pour les tapis épais."", ""Autonomie annoncée de 60 minutes en mode Eco, avec batterie interchangeable pour prolonger le temps d'utilisation."", ""Filtration HEPA avancée capturant 99,97% des particules fines, bénéfique pour les allergiques."", ""Écran LCD intuitif affichant l'autonomie restante et les modes de nettoyage en temps réel."", ""Polyvalence : se transforme en aspirateur à main avec 6 accessoires inclus, adapté à différents types de sols.""]","[""Autonomie réelle inférieure aux 60 minutes annoncées : environ 35-40 minutes en mode Auto, 20 minutes en Boost."", ""Prix élevé (souvent au-dessus de 500 €) comparé à des concurrents offrant des performances similaires."", ""Chargeur mural non inclus, nécessitant un achat séparé pour un rangement optimal."", ""Bac à poussière de 0,76 L relativement petit, nécessitant des vidanges fréquentes pour les grandes surfaces.""]","{""Design"": 8.5, ""Qualité"": 8.0, ""Polyvalence"": 7.0, ""Qualité/Prix"": 7.0, ""Facilité d'utilisation"": 7.5}","Le Dyson V11 Absolute Extra est un aspirateur balai sans fil haut de gamme, lancé en avril 2020. Il se distingue par une puissance d'aspiration élevée (jusqu'à 185 AW en mode Boost) et une autonomie annoncée jusqu'à 60 minutes en mode Eco, grâce à une batterie lithium-ion interchangeable. L'écran LCD intégré affiche en temps réel le mode sélectionné, l'autonomie restante et les notifications d'entretien. Le système de filtration avancé capture 99,97% des particules de 0,3 micron. Livré avec 6 accessoires dont un rouleau souple pour sols durs et une tête motorisée pour moquette. Les avis clients (4,1/5 sur 148 évaluations) soulignent une excellente performance sur tous types de sols, mais certains regrettent un prix élevé et une autonomie réelle inférieure aux 60 minutes annoncées (environ 35-40 min en mode Auto). Le rangement mural est pratique, mais le chargeur n'est pas fourni avec une fixation murale. Le bac à poussière se vide hygiéniquement d'une seule main. Ce modèle convient aux propriétaires de grandes surfaces (jusqu'à 150 m²) recherchant une puissance maximale et une polyvalence, mais le rapport qualité-prix est discutable face à des concurrents comme le Samsung Jet 90.","{""Amazon"": {""url"": ""https://www.amazon.fr/dp/B086PXHDGM?tag=troviio-21"", ""inStock"": true, ""priceEur"": 679, ""merchantName"": ""Amazon""}}",True
Aspirateur balai,aspirateur-balai,24,Dyson,V12 Detect Slim+,dyson-dyson-v12-detect-slim,B0C1PX36JB,619,https://m.media-amazon.com/images/I/11QJHWSjWML._SL1500_.jpg,https://www.amazon.fr/dp/B0C1PX36JB?tag=troviio-21,8.0,"Ce produit est idéal pour les propriétaires d'animaux ou les allergiques vivant en appartement avec sols durs, mais pas pour les grandes maisons avec moquette épaisse ou les budgets serrés.","Le Dyson V12 Detect Slim+ est un aspirateur balai sans fil ultra-léger et maniable, idéal pour les sols durs. Il se distingue par son laser qui révèle la poussière invisible et son compteur de particules en temps réel.","{""bac"": ""0.2 L"", ""poids"": ""2.2 kg"", ""autonomie"": ""60 min"", ""plus_leger"": ""24% vs V15"", ""technologie"": ""Laser slim""}","[""Laser vert intégré qui révèle jusqu'à 2 fois plus de poussière invisible sur sol dur, selon les tests utilisateurs."", ""Poids ultra-léger de 2,2 kg, facilitant le nettoyage en hauteur et les escaliers."", ""Autonomie de 60 minutes en mode Eco, suffisante pour un appartement de 80 m² en une charge."", ""Filtration HEPA certifiée capturant 99,99 % des particules fines, idéal pour les allergiques."", ""Affichage LCD en temps réel de la taille et du nombre de particules aspirées, motivant un nettoyage plus approfondi.""]","[""Prix élevé d'environ 600 €, soit 30 % de plus que des concurrents comme le Samsung Bespoke Jet."", ""Réservoir de poussière de seulement 0,35 L, nécessitant une vidange fréquente (tous les 2-3 jours pour un foyer avec animaux)."", ""Performances décevantes sur moquette épaisse : perte d'aspiration de 20 % par rapport aux sols durs, selon les retours."", ""Bouton de puissance à maintenir enfoncé en continu, fatiguant pour les longues sessions de nettoyage.""]","{""Design"": 8.5, ""Qualité"": 8.0, ""Polyvalence"": 7.0, ""Qualité/Prix"": 7.0, ""Facilité d'utilisation"": 7.5}","Le Dyson V12 Detect Slim+ est un aspirateur balai sans fil haut de gamme qui se positionne comme un outil de nettoyage précis pour les sols durs et les petites surfaces. Il se distingue par son design léger (2,2 kg) et sa technologie de détection des particules, qui affiche en temps réel la taille et le nombre de poussières aspirées. Les retours utilisateurs soulignent une excellente maniabilité et une autonomie correcte (jusqu'à 60 minutes en mode Eco), mais des performances perfectibles sur moquette épaisse et un prix élevé (environ 600 €). Les points clés incluent la qualité de filtration HEPA, le laser vert pour révéler la poussière invisible sur sol dur, et la polyvalence grâce aux accessoires. En revanche, le réservoir est petit (0,35 L) et le système de vidange peut être salissant. Le verdict : idéal pour les propriétaires d'animaux ou les allergiques cherchant un aspirateur léger et précis pour sols durs, mais déconseillé pour les grands espaces ou les moquettes épaisses.","{""Amazon"": {""url"": ""https://www.amazon.fr/dp/B0C1PX36JB?tag=troviio-21"", ""inStock"": true, ""priceEur"": 619, ""merchantName"": ""Amazon""}}",True
Aspirateur balai,aspirateur-balai,25,Samsung,Jet 75 Complete,samsung-jet-75,B08R2D7S4G,375,https://m.media-amazon.com/images/I/41ZbW0DPazL.jpg,https://www.amazon.fr/dp/B08R2D7S4G?tag=troviio-21,8.0,"Ce produit est idéal pour les petits foyers ou appartements avec des sols durs et des besoins d'aspiration fréquents, mais pas pour les grandes surfaces ou les budgets limités.","Le Samsung Jet 75 est un aspirateur balai sans fil puissant et léger, conçu pour remplacer un aspirateur traîneau grâce à sa bonne filtration et sa maniabilité.","{""type"": ""sans_fil"", ""annee"": 2024, ""design"": ""standard"", ""parquet"": true, ""segment"": ""mid"", ""moquette"": true, ""poids_kg"": 2.6, ""ecran_lcd"": true, ""ergonomie"": ""interrupteur"", ""filtration"": ""HEPA"", ""application"": false, ""mini_turbine"": true, ""aspiration_AW"": 200, ""aspiration_Pa"": 22000, ""autonomie_min"": 60, ""batterie_type"": ""Li-Ion"", ""capteur_laser"": false, ""poils_animaux"": true, ""tube_flexible"": false, ""anti_allergene"": true, ""brosse_animaux"": true, ""brosse_parquet"": true, ""reservoir_vide"": ""manuel"", ""brosse_fissures"": true, ""detection_laser"": false, ""convertible_main"": true, ""detecte_type_sol"": false, ""temps_charge_min"": 210, ""brosse_principale"": ""motorisee"", ""detecte_poussiere"": false, ""filtration_niveau"": ""H13"", ""profil_recommande"": [""alternative_dyson_v10"", ""maison_moyenne"", ""hepa_budget""], ""batteries_incluses"": 1, ""puissance_moteur_W"": 550, ""poids_corps_seul_kg"": 1.6, ""batterie_remplacable"": true, ""capacite_reservoir_L"": 0.8, ""couleurs_disponibles"": [""argent"", ""menthe""], ""coût_3ans_estime_eur"": 500, ""duree_vie_estimee_ans"": 5, ""nb_accessoires_inclus"": 4, ""autonomie_mode_max_min"": 6, ""gating_rules_specifiques"": [""GR-ASPI-004""]}","[""Puissance d'aspiration constante grâce à la technologie cyclonique, efficace sur sols durs et tapis."", ""Autonomie de 40 minutes en mode standard, suffisante pour un appartement de 80 m²."", ""Batterie amovible permettant de prolonger l'usage avec une batterie supplémentaire (vendue séparément)."", ""Filtration à 5 étapes capturant 99,9% des particules fines, idéal pour les allergiques."", ""Design léger (2,6 kg) et flexible, facilitant le nettoyage sous les meubles.""]","[""Réservoir de poussière de 0,5 L trop petit, nécessitant des vidanges fréquentes."", ""Prix élevé (environ 450€) comparé à des concurrents offrant des performances similaires."", ""Bruit notable en mode turbo (environ 80 dB), gênant pour une utilisation tardive."", ""Support mural non inclus, obligeant à un achat séparé pour le rangement.""]","{""Design"": 8.5, ""Qualité"": 8.0, ""Polyvalence"": 7.0, ""Qualité/Prix"": 7.0, ""Facilité d'utilisation"": 7.5}","Le Samsung Jet 75 Complete est un aspirateur balai sans fil positionné sur le segment milieu-haut de gamme. Il se distingue par sa technologie cyclonique et sa batterie amovible, offrant une autonomie jusqu'à 40 minutes en mode standard. Les retours utilisateurs soulignent une puissance d'aspiration constante, même sur les sols durs et tapis à poils courts. Le système de filtration à 5 étapes retient 99,9% des particules fines, ce qui est apprécié des personnes allergiques. Cependant, le réservoir de 0,5 L nécessite des vidanges fréquentes, surtout en présence d'animaux. Le prix, autour de 400-500€, est jugé élevé pour les performances, mais la qualité de fabrication et la polyvalence (accessoires inclus) justifient l'investissement pour un usage quotidien dans des foyers de taille moyenne. En résumé, c'est un bon choix pour ceux qui recherchent un aspirateur performant et pratique, mais moins adapté aux grandes surfaces ou aux budgets serrés.","{""Amazon"": {""url"": ""https://www.amazon.fr/dp/B08R2D7S4G?tag=troviio-21"", ""inStock"": true, ""priceEur"": 375, ""merchantName"": ""Amazon""}}",True
