catégorie_nom,catégorie_slug,rang_top,marque,nom_produit,slug,asin,prix_eur,image_url,lien_affiliation,score_estimated,verdict,description,specs,pros,cons,use_case_scores,test_summary,merchant_links,is_active
Aspirateur balai,aspirateur-balai,26,Rowenta,X-Force Flex 14.60 Allergy,rowenta-x-force-flex-14-60,B03KFCU5NS,380,https://m.media-amazon.com/images/I/B03KFCU5NS._SL1500_.jpg,https://www.amazon.fr/dp/B03KFCU5NS?tag=troviio-21,8.0,"Idéal pour les allergiques recherchant une filtration performante et une flexibilité d'usage, mais à éviter si vous avez une grande surface ou besoin d'une longue autonomie en mode turbo. À acheter autour de 350 €.","L'aspirateur balai Rowenta X-Force Flex 14.60 offre une grande autonomie et une flexibilité de nettoyage, mais son poids et son autonomie en mode boost sont des points faibles.","{""type"": ""sans_fil"", ""annee"": 2024, ""design"": ""standard"", ""parquet"": true, ""segment"": ""mid"", ""moquette"": true, ""poids_kg"": 3.2, ""ecran_lcd"": true, ""ergonomie"": ""gachette_continue"", ""filtration"": ""HEPA"", ""application"": false, ""mini_turbine"": true, ""aspiration_AW"": 200, ""aspiration_Pa"": 20000, ""autonomie_min"": 70, ""batterie_type"": ""Li-Ion"", ""capteur_laser"": false, ""poils_animaux"": true, ""tube_flexible"": true, ""alerte_troviio"": ""HEPA H12 = insuffisant pour allergiques sévères (H13 requis). Recommander uniquement si allergie légère ou pas d'allergie."", ""anti_allergene"": true, ""brosse_animaux"": true, ""brosse_parquet"": true, ""reservoir_vide"": ""manuel"", ""brosse_fissures"": true, ""detection_laser"": false, ""convertible_main"": true, ""detecte_type_sol"": true, ""temps_charge_min"": 180, ""brosse_principale"": ""motorisee"", ""detecte_poussiere"": false, ""filtration_niveau"": ""H12"", ""profil_recommande"": [""dos_sensible"", ""grande_famille"", ""meubles_bas"", ""SAV_france""], ""batteries_incluses"": 1, ""puissance_moteur_W"": 480, ""poids_corps_seul_kg"": 1.9, ""batterie_remplacable"": true, ""capacite_reservoir_L"": 0.9, ""couleurs_disponibles"": [""noir"", ""gris""], ""coût_3ans_estime_eur"": 530, ""duree_vie_estimee_ans"": 5, ""nb_accessoires_inclus"": 5, ""autonomie_mode_max_min"": 6, ""gating_rules_specifiques"": [""GR-ASPI-003"", ""GR-ASPI-004""]}","[""Filtration HEPA certifiée, capturant 99,97% des particules fines jusqu'à 0,3 micron, idéal pour les allergiques."", ""Système Flex permettant de plier le tube à 180° pour aspirer sous les meubles bas sans effort."", ""Puissance d'aspiration de 150 AW, offrant un nettoyage efficace sur sols durs et tapis à poils courts."", ""Autonomie de 45 minutes en mode standard, suffisante pour un logement de 80 m² en une charge.""]","[""Autonomie réduite à environ 15 minutes en mode turbo, limitant l'usage intensif."", ""Poids de 3,5 kg, plus lourd que la moyenne des aspirateurs balais, pouvant fatiguer lors de longues sessions."", ""Réservoir de poussière de 0,5 L, nécessitant des vidanges fréquentes, surtout en présence d'animaux.""]","{""Design"": 8.5, ""Qualité"": 8.0, ""Polyvalence"": 7.0, ""Qualité/Prix"": 7.0, ""Facilité d'utilisation"": 7.5}","Le Rowenta X-Force Flex 14.60 Allergy est un aspirateur balai sans fil conçu pour les personnes allergiques, avec un filtre HEPA certifié. Il offre une puissance d'aspiration de 150 AW et une autonomie allant jusqu'à 45 minutes en mode standard. Le système Flex permet de plier le tube pour aspirer sous les meubles sans se baisser. Les retours utilisateurs soulignent une bonne efficacité sur sols durs et une filtration performante, mais une autonomie réduite en mode turbo (environ 15 minutes) et un poids de 3,5 kg qui peut être fatigant pour une utilisation prolongée. Le réservoir de 0,5 L est jugé petit, nécessitant des vidanges fréquentes. Ce modèle s'adresse aux personnes allergiques ou soucieuses de la qualité de l'air, recherchant un aspirateur balai puissant pour des surfaces principalement dures, avec un budget autour de 300-400 €.","{""Amazon"": {""url"": ""https://www.amazon.fr/dp/B03KFCU5NS?tag=troviio-21"", ""inStock"": true, ""currency"": ""EUR"", ""priceEur"": 400}}",True
Aspirateur balai,aspirateur-balai,27,Rowenta,X-Force Flex 8.60,rowenta-x-force-8-60,B08D46HM8N,337,https://m.media-amazon.com/images/I/11QJHWSjWML._SL1500_.jpg,https://www.amazon.fr/dp/B08D46HM8N?tag=troviio-21,6.5,"Idéal pour les petits appartements ou maisons jusqu'à 80 m², l'aspirateur Rowenta X-Force Flex 8.60 offre une puissance remarquable et une grande maniabilité. À choisir si le bruit et la capacité du réservoir ne sont pas des critères rédhibitoires.","Le Rowenta X-Force Flex 8.60 est un aspirateur balai flexible conçu pour un nettoyage rapide du quotidien, avec un bon rapport qualité-prix.","{""LIBERTÉ DE MOUVEMENT"": ""grâce à la position Stop &amp; Go, plus besoin de poser le manche sur le sol lorsque vous aspirez des meubles avec l&#39;aspirateur à main : le manche et la brosse tiennent debout tout seuls !"", ""AUTONOMIE DE FONCTIONNEMENT ACCRUE"": ""la batterie amovible de 22 V assure une puissance d&#39;aspiration élevée, jusqu&#39;à 45 minutes en mode standard, et se recharge facilement sur n&#39;importe quelle prise standard""}","[""Puissance d'aspiration élevée de 185W, supérieure à la moyenne des aspirateurs balais sans fil."", ""Système Flex permettant de plier le tube pour atteindre facilement sous les meubles bas (hauteur minimale de 15 cm)."", ""Batterie lithium amovible avec autonomie de 45 minutes, rechargeable en 35 minutes."", ""Tête d'aspiration Deep Power LED qui éclaire les zones sombres pour un nettoyage efficace."", ""Connectivité Bluetooth pour un suivi via l'application (entretien, autonomie).""]","[""Niveau sonore élevé (environ 80 dB) signalé par plusieurs utilisateurs."", ""Capacité du réservoir à poussière limitée à 0,5 L, nécessitant des vidanges fréquentes."", ""Poids de 3,2 kg, un peu lourd pour une utilisation prolongée en mode balai."", ""Pas de mode turbo pour les taches tenaces, seulement un mode standard et un mode éco.""]","{""Design"": 8.0, ""Qualité"": 6.5, ""Polyvalence"": 6.0, ""Qualité/Prix"": 7.5, ""Facilité d'utilisation"": 6.0}","L'aspirateur balai sans fil Rowenta X-Force Flex 8.60 se distingue par sa puissance de 185W et son système Flex qui permet de passer sous les meubles bas sans se baisser. Avec une autonomie de 45 minutes et une batterie lithium amovible, il offre une bonne flexibilité d'utilisation. La note moyenne de 4,0/5 sur 803 avis confirme une satisfaction générale, mais certains utilisateurs regrettent un bruit élevé et une capacité du réservoir limitée. Ce modèle est idéal pour les petits et moyens logements, mais moins adapté aux grandes surfaces ou aux sols très encrassés.","{""Amazon"": {""url"": ""https://www.amazon.fr/dp/B08D46HM8N?tag=troviio-21"", ""inStock"": true, ""priceEur"": 337, ""merchantName"": ""Amazon""}}",True
Lave-linge,lave-linge,1,Samsung,Frontal washing machine WW11DG5B25AH,lave-linge-samsung-samsung-ww11dg5b25ah,B0CZS31LN3,634,https://m.media-amazon.com/images/I/B0CZS31LN3._SL1500_.jpg,https://www.amazon.fr/dp/B0CZS31LN3?tag=troviio-21,8.5,"Idéal pour les grandes familles ou les gros volumes de linge, ce Samsung offre une capacité généreuse et une durabilité solide à un prix compétitif, mais sacrifie les fonctionnalités connectées et la finesse des programmes.","La machine à laver frontale Samsung WW11DG5B25AH est un appareil performant conçu pour les familles nombreuses ou les utilisateurs exigeants. Avec une capacité de 11 kg et une vitesse d'essorage de 1400 tr/min, elle offre un lavage efficace pour les grandes charges. Sa technologie EcoBubble™ permet de dissoudre le détergent dans l'eau avant qu'il n'atteigne le linge, assurant un lavage en profondeur même à basse température. Le moteur Digital Inverter est silencieux et durable, avec une garantie de 20 ans. Idéale pour ceux qui recherchent un équipement fiable et économe en énergie, cette machine combine performance et innovation.","{""Capacité"": ""11 kg"", ""Technologie"": ""EcoBubble"", ""Type de moteur"": ""Digital Inverter"", ""Dimensions (LxPxH)"": ""60 x 55 x 85 cm"", ""Vitesse d'essorage"": ""1400 tr/min"", ""Classe énergétique"": ""A"", ""Niveau sonore (lavage/essorage)"": ""52 dB / 74 dB""}","[""Grande capacité de 11 kg adaptée aux familles"", ""Technologie EcoBubble pour un lavage efficace à basse température"", ""Moteur Digital Inverter silencieux et durable avec garantie 20 ans""]","[""Prix élevé par rapport aux modèles d'entrée de gamme"", ""Programmes parfois longs""]","{""design"": 8, ""durabilite"": 9, ""innovation"": 8, ""performance"": 9, ""qualite_prix"": 7}","Le Samsung WW11DG5B25AH est une machine à laver frontale de 11 kg, idéale pour les grandes familles ou les foyers ayant des besoins de lavage importants. Avec un volume de 71,5 litres, elle offre une capacité généreuse pour traiter de grosses charges. Son moteur Digital Inverter est réputé pour sa fiabilité et son efficacité énergétique, et l'indice de durabilité de 8,7/10 (selon l'étiquette française) témoigne d'une bonne réparabilité et fiabilité. La classe énergétique A assure une consommation maîtrisée, tandis que l'essorage à 1400 tr/min et le niveau sonore de 72 dB sont dans la moyenne. Les retours clients sur la marque Samsung sont très positifs (91% de retours positifs sur 50 000+ avis). Ce modèle convient particulièrement aux utilisateurs recherchant un grand volume, une bonne durabilité et une marque reconnue, mais il manque de fonctionnalités connectées ou de vapeur que l'on trouve sur des modèles plus haut de gamme.","{""Amazon"": {""url"": ""https://www.amazon.fr/dp/B0CZS31LN3?tag=troviio-21"", ""inStock"": true, ""priceEur"": 634, ""merchantName"": ""Amazon""}}",True
Lave-linge,lave-linge,2,Miele,WCA030 WPS Active,miele-wca030,B089W8VPTW,415,https://m.media-amazon.com/images/I/41ZbW0DPazL.jpg,https://www.amazon.fr/dp/B089W8VPTW?tag=troviio-21,8.5,"Idéal pour les petits foyers (1-3 personnes) qui veulent une machine fiable et durable, sans gadgets. À acheter si le budget le permet et que la simplicité prime.","Le Miele WCA030 WPS Active est un lave-linge frontal de 7 kg, alliant performance de lavage et faible consommation d'eau.","{""wifi"": false, ""vapeur"": false, ""attention"": ""Profondeur 63.6 cm — verifier la niche"", ""slim_50cm"": false, ""nom_moteur"": ""ProfiEco"", ""capacite_kg"": 7, ""nom_tambour"": ""Hydrogliss"", ""type_moteur"": ""inverter_brushless"", ""garantie_ans"": 2, ""nb_programmes"": 12, ""depart_differe"": true, ""tambour_litres"": 59, ""bruit_lavage_db"": 50, ""essorage_tr_min"": 1400, ""bruit_essorage_db"": 72, ""programme_hygiene"": true, ""classe_energetique"": ""B"", ""dosage_automatique"": false, ""garantie_moteur_ans"": 10, ""duree_vie_testee_ans"": 20, ""programme_laine_soie"": true, ""indice_reparabilite_10"": 7.2, ""duree_cycle_coton60_min"": 179, ""dosage_capsules_optionnel"": ""CapDosing Miele"", ""consommation_kwh_100cycles"": 51, ""consommation_eau_litres_cycle"": 45}","[""Construction robuste typique de Miele, avec une garantie de 10 ans sur le tambour."", ""Système WPS (Water Protection System) pour une sécurité anti-fuite renforcée."", ""Efficacité de lavage A+++ (classe énergétique) et essorage silencieux (73 dB)."", ""Programmes variés incluant un cycle rapide de 20 minutes pour petites charges.""]","[""Prix élevé (environ 700€) comparé à des concurrents avec des fonctionnalités similaires."", ""Pas de connectivité Wi-Fi ni de commande via application."", ""Capacité de 8 kg limitée pour les grandes familles (au-delà de 4 personnes)."", ""Absence de hublot grand angle, rendant le chargement moins pratique.""]","{""Design"": 8.0, ""Qualité"": 8.5, ""Polyvalence"": 7.0, ""Qualité/Prix"": 6.5, ""Facilité d'utilisation"": 7.5}","Le Miele WCA030 WPS Active est une machine à laver frontale de la marque allemande réputée pour sa fiabilité. Avec une capacité de 8 kg et une vitesse d'essorage maximale de 1400 tr/min, elle se positionne comme un modèle d'entrée de gamme haut de gamme. Les retours clients sont rares mais positifs, soulignant la qualité de construction et l'efficacité de lavage. Le système WPS (Water Protection System) offre une sécurité anti-fuite. Cependant, l'absence de fonctionnalités connectées et un prix élevé par rapport à la concurrence sont des points à considérer. Ce produit s'adresse aux utilisateurs recherchant une machine durable et simple, sans fioritures technologiques. Le verdict : un investissement solide pour ceux qui privilégient la longévité et la performance de lavage.","{""Amazon"": {""url"": ""https://www.amazon.fr/dp/B089W8VPTW?tag=troviio-21"", ""inStock"": true, ""priceEur"": 415, ""merchantName"": ""Amazon""}}",True
Lave-linge,lave-linge,3,Electrolux,Front washing machine EW6FI4805AR,lave-linge-electrolux-electrolux-ew7f3929bf,B0G1TL67XQ,457,https://m.media-amazon.com/images/I/413xK9HweUL._SL1500_.jpg,https://www.amazon.fr/dp/B0G1TL67XQ?tag=troviio-21,8.5,"Idéale pour les budgets serrés (350-400 €) recherchant une machine fiable pour un usage familial standard, mais pas pour ceux qui ont besoin de cycles rapides efficaces ou de fonctionnalités modernes comme la vapeur.","Le lave-linge frontal Electrolux EW6FI4805AR est un appareil performant et économe, idéal pour les familles cherchant un nettoyage efficace tout en réduisant leur consommation d'eau et d'énergie. Doté de la technologie UltraCare, il assure un traitement délicat des textiles tout en éliminant les taches tenaces. Sa capacité de 8 kg convient aux foyers de taille moyenne, et son design moderne s'intègre facilement dans toute buanderie. Grâce à ses programmes variés, dont un cycle rapide de 20 minutes, il répond aux besoins quotidiens de lessive.","{""Volume du tambour"": ""53 litres"", ""Système SensiCare"": ""Économies d&#39;eau et d&#39;énergie"", ""Capacité de lavage"": ""8 kg"", ""Classe d&#39;énergie"": ""A"", ""Chargement par le haut"": ""Lave-linge"", ""Dimensions (L x H x P)"": ""59.6 x 84.7 x 57.6 cm"", ""Vitesse d&#39;essorage"": ""1400 tours/minute""}","[""Technologie UltraCare pour un lavage doux et efficace"", ""Classe énergétique A (efficacité énergétique élevée)"", ""Programme rapide de 20 minutes pour les petites charges""]","[""Pas de connexion Wi-Fi intégrée"", ""Niveau sonore en essorage un peu élevé (76 dB)""]","{""design"": 7, ""durabilite"": 8, ""innovation"": 7, ""performance"": 9, ""qualite_prix"": 8}","La machine à laver frontale Electrolux EW6FI4805AR se positionne comme un modèle d'entrée de gamme de la marque, visant les foyers cherchant un équipement fiable sans fonctionnalités superflues. Avec une capacité de 8 kg et une vitesse d'essorage de 1200 tr/min, elle répond aux besoins standards d'une famille de 3-4 personnes. Les retours utilisateurs mettent en avant une efficacité de lavage correcte pour les programmes quotidiens, mais des performances en demi-teinte sur les cycles rapides et les taches tenaces. Le niveau sonore est jugé acceptable pour la catégorie, bien que quelques plaintes concernent les vibrations lors de l'essorage à pleine charge. Côté consommation, elle affiche une classe énergétique A (ancien label), ce qui la rend économique sur le long terme. Le principal point fort est son rapport qualité-prix attractif, souvent cité comme le meilleur de sa gamme. En revanche, l'absence de fonction vapeur et de connectivité la rend moins polyvalente que des modèles plus récents. Le verdict : idéale pour les budgets serrés recherchant une machine simple et efficace, mais décevante pour ceux qui exigent des cycles rapides performants ou des options avancées.","{""Amazon"": {""url"": ""https://www.amazon.fr/dp/B0G1TL67XQ?tag=troviio-21"", ""inStock"": true, ""priceEur"": 457, ""merchantName"": ""Amazon""}}",True
Lave-linge,lave-linge,4,Bosch,Bosch Série 4 WAU28RH9FF Lave-linge 8kg 1400tr,lave-linge-bosch-bosch-serie-6-wau28rh9ff,B0CGZCSR2X,429,https://m.media-amazon.com/images/I/413xK9HweUL._SL1500_.jpg,https://www.amazon.fr/dp/B0CGZCSR2X?tag=troviio-21,8.5,"Idéal pour les familles soucieuses de leur budget énergétique et de l'environnement, ce Bosch WAN28258FR offre un bon rapport qualité-prix à environ 634 €. Si vous n'avez pas besoin de fonctions connectées ou vapeur, c'est un choix fiable et efficace.","Le lave-linge Bosch Série 4 WAN28258FR est un appareil performant et fiable, idéal pour les familles ou les couples cherchant une machine à laver de qualité à un prix abordable. Avec une capacité de 8 kg et une vitesse d'essorage de 1400 tr/min, il offre un excellent rapport qualité-prix. Sa technologie ActiveWater adapte la consommation d'eau à la charge, tandis que le moteur EcoSilence Drive garantit un fonctionnement silencieux et durable. Le design Porthole avec hublot large facilite le chargement et le déchargement du linge.","{""Capacité"": ""8 kg"", ""Type de moteur"": ""EcoSilence Drive"", ""Dimensions (HxLxP)"": ""84.5 x 60 x 59 cm"", ""Vitesse d'essorage"": ""1400 tr/min"", ""Classe énergétique"": ""B"", ""Niveau sonore (essorage)"": ""72 dB""}","[""Moteur EcoSilence Drive silencieux et durable"", ""Technologie ActiveWater pour une consommation d'eau optimisée"", ""Bonne capacité de 8 kg adaptée aux familles""]","[""Pas de connexion Wi-Fi ni fonctionnalités connectées"", ""Programmes limités par rapport aux modèles haut de gamme""]","{""design"": 7, ""durabilite"": 9, ""innovation"": 6, ""performance"": 8, ""qualite_prix"": 9}","Le Bosch WAN28258FR est un lave-linge frontal de la série 4, d'une capacité de 8 kg et d'une vitesse d'essorage de 1400 tr/min. Il se distingue par son moteur Eco Silence Drive, qui promet un fonctionnement silencieux et une durabilité accrue avec une garantie de 10 ans sur les pièces. Selon les spécifications, il consomme 20% d'énergie en moins par rapport à un appareil de classe A, ce qui est un atout pour les économies d'énergie. La technologie ActiveWater Plus adapte la consommation d'eau à la charge, optimisant ainsi les ressources. Le Speed Perfect permet de réduire le temps de cycle jusqu'à 65%, un gain de temps appréciable. Cependant, l'absence de fonction vapeur et de connexion Wi-Fi peut être un frein pour certains utilisateurs. Ce modèle convient aux familles de taille moyenne cherchant un appareil fiable et économe, sans fioritures technologiques. En résumé, c'est un lave-linge solide et efficace, mais qui manque de fonctionnalités avancées.","{""Amazon"": {""url"": ""https://www.amazon.fr/dp/B0CGZCSR2X?tag=troviio-21"", ""inStock"": true, ""priceEur"": 429, ""merchantName"": ""Amazon""}}",True
Lave-linge,lave-linge,5,LG,Frontal washing machine F14R15WHS,lave-linge-lg-lg-f4wv709s1e,B0CM223932,520,https://m.media-amazon.com/images/I/B0CM223932._SL1500_.jpg,https://www.amazon.fr/dp/B0CM223932?tag=troviio-21,8.5,"Ce lave-linge LG est un bon choix pour les familles recherchant un appareil fiable avec option vapeur et anti-allergies, à condition que les dimensions et l'absence de connectivité ne soient pas rédhibitoires. Idéal si trouvé à un prix compétitif (sous 500€).","Le LG F14R15WHS est une machine à laver frontale de 14 kg, idéale pour les familles nombreuses ou les utilisateurs ayant de gros volumes de linge. Équipée de la technologie AI DD (Intelligent Drive), elle optimise les mouvements de lavage en fonction du type de tissu, garantissant un soin optimal et une efficacité énergétique. Avec sa classe énergétique A, elle permet de réaliser des économies d'énergie tout en offrant des performances de lavage remarquables. Son design élégant en blanc s'intègre facilement dans toute buanderie, et ses fonctionnalités intelligentes, comme le contrôle via smartphone, en font un choix moderne et pratique.","{""Capacité"": ""14 kg"", ""Type de moteur"": ""Inverseur"", ""Dimensions (LxPxH)"": ""60 x 67 x 85 cm"", ""Vitesse d'essorage"": ""1400 tr/min"", ""Classe énergétique"": ""A""}","[""Grande capacité de 14 kg adaptée aux familles"", ""Technologie AI DD pour un lavage personnalisé"", ""Classe énergétique A pour des économies d'énergie""]","[""Prix élevé par rapport aux modèles standards"", ""Peut être bruyante en essorage""]","{""design"": 8, ""durabilite"": 8, ""innovation"": 9, ""performance"": 9, ""qualite_prix"": 7}","Le LG F14R15WHS est un lave-linge frontal blanc de la marque LG, avec une capacité de 10 kg et une vitesse d'essorage de 1400 tours/min. Il intègre un système vapeur et un compartiment anti-allergies, ce qui le rend adapté aux personnes sensibles. Les dimensions sont de 56,5 cm de profondeur, largeur et 85 cm de hauteur. Les avis clients sur Amazon affichent une note de 4,2/5 sur 43 évaluations, indiquant une satisfaction générale. Cependant, le manque d'informations détaillées sur les performances spécifiques (consommation, bruit) limite l'analyse. Le produit semble fiable pour un usage familial, mais pourrait manquer de fonctionnalités avancées par rapport à des modèles plus récents.","{""Amazon"": {""url"": ""https://www.amazon.fr/dp/B0CM223932?tag=troviio-21"", ""inStock"": true, ""priceEur"": 520.0, ""merchantName"": ""Amazon""}}",True
Lave-linge,lave-linge,6,Samsung,Samsung Série 5 WW90DG5B25AH Lave-linge 9kg 1400tr,lave-linge-samsung-samsung-serie-5-ww90dg5b25ah,B0DW9KP527,394,https://m.media-amazon.com/images/I/41ZbW0DPazL.jpg,https://www.amazon.fr/dp/B0DW9KP527?tag=troviio-21,8.2,"Ce lave-linge Samsung est idéal pour les familles cherchant un bon rapport qualité-prix avec une capacité généreuse et une faible consommation, mais déconseillé à ceux qui privilégient la durabilité ou les fonctionnalités connectées.","Le Samsung WW90T4046EE est un lave-linge frontal de 9 kg avec une vitesse d'essorage de 1400 tr/min, idéal pour les familles. Il offre des performances de lavage efficaces grâce à la technologie EcoBubble et un moteur Digital Inverter silencieux et durable. Ce modèle convient aux utilisateurs recherchant un appareil fiable et économique.",,"[""Technologie EcoBubble pour un lavage efficace à basse température"", ""Moteur Digital Inverter silencieux et durable"", ""Capacité de 9 kg adaptée aux familles""]","[""Absence de connexion Wi-Fi et de fonctions connectées""]","{""design"": 7, ""durabilite"": 9, ""innovation"": 6, ""performance"": 8, ""qualite_prix"": 8}","La Samsung WW90T4046EE est une machine à laver frontale solide et performante, parfaite pour les familles cherchant un bon rapport qualité-prix sans fioritures connectées. Son moteur Digital Inverter garantit une longévité remarquable et l'EcoBubble lave efficacement à froid, ce qui réduit les coûts énergétiques. Cependant, l'absence de la porte AddWash et de connectivité peut décevoir les utilisateurs habitués aux modèles plus récents, et le bruit en essorage reste perfectible. Globalement, elle offre un lavage de qualité pour un usage intensif, mais manque de quelques innovations pratiques pour justifier un prix premium. Note : 8,2/10.","{""Amazon"": {""url"": ""https://www.amazon.fr/dp/B0DW9KP527?tag=troviio-21"", ""inStock"": true, ""priceEur"": 394, ""merchantName"": ""Amazon""}}",True
